Sheet: Sheet1
A1: Test nr | B1: groupSize | C1: nrOfIndividuals | D1: crossover_ratio | E1: mutation_potency | F1: mutation_ratio | G1: Result | H1: RANK
A2: 1 | B2: 10 | C2: 833 | D2: 0.600000 | E2: 0.001000 | F2: 0.700000 | G2: 1271 | H2: of:=RANK([.G2];[.$G$2:.$G$244]) -> 144
A3: 2 | B3: 10 | C3: 833 | D3: 0.600000 | E3: 0.001000 | F3: 0.800000 | G3: 1379 | H3: of:=RANK([.G3];[.$G$2:.$G$244]) -> 111
A4: 3 | B4: 10 | C4: 833 | D4: 0.600000 | E4: 0.001000 | F4: 0.900000 | G4: 1402 | H4: of:=RANK([.G4];[.$G$2:.$G$244]) -> 106
A5: 4 | B5: 10 | C5: 833 | D5: 0.600000 | E5: 0.010000 | F5: 0.700000 | G5: 1448 | H5: of:=RANK([.G5];[.$G$2:.$G$244]) -> 88
A6: 5 | B6: 10 | C6: 833 | D6: 0.600000 | E6: 0.010000 | F6: 0.800000 | G6: 1378 | H6: of:=RANK([.G6];[.$G$2:.$G$244]) -> 112
A7: 6 | B7: 10 | C7: 833 | D7: 0.600000 | E7: 0.010000 | F7: 0.900000 | G7: 1284 | H7: of:=RANK([.G7];[.$G$2:.$G$244]) -> 141
A8: 7 | B8: 10 | C8: 833 | D8: 0.600000 | E8: 0.100000 | F8: 0.700000 | G8: 809 | H8: of:=RANK([.G8];[.$G$2:.$G$244]) -> 219
A9: 8 | B9: 10 | C9: 833 | D9: 0.600000 | E9: 0.100000 | F9: 0.800000 | G9: 802 | H9: of:=RANK([.G9];[.$G$2:.$G$244]) -> 221
A10: 9 | B10: 10 | C10: 833 | D10: 0.600000 | E10: 0.100000 | F10: 0.900000 | G10: 682 | H10: of:=RANK([.G10];[.$G$2:.$G$244]) -> 243
A11: 10 | B11: 10 | C11: 833 | D11: 0.700000 | E11: 0.001000 | F11: 0.700000 | G11: 1372 | H11: of:=RANK([.G11];[.$G$2:.$G$244]) -> 115
A12: 11 | B12: 10 | C12: 833 | D12: 0.700000 | E12: 0.001000 | F12: 0.800000 | G12: 1241 | H12: of:=RANK([.G12];[.$G$2:.$G$244]) -> 152
A13: 12 | B13: 10 | C13: 833 | D13: 0.700000 | E13: 0.001000 | F13: 0.900000 | G13: 1393 | H13: of:=RANK([.G13];[.$G$2:.$G$244]) -> 108
A14: 13 | B14: 10 | C14: 833 | D14: 0.700000 | E14: 0.010000 | F14: 0.700000 | G14: 1342 | H14: of:=RANK([.G14];[.$G$2:.$G$244]) -> 122
A15: 14 | B15: 10 | C15: 833 | D15: 0.700000 | E15: 0.010000 | F15: 0.800000 | G15: 1333 | H15: of:=RANK([.G15];[.$G$2:.$G$244]) -> 125
A16: 15 | B16: 10 | C16: 833 | D16: 0.700000 | E16: 0.010000 | F16: 0.900000 | G16: 1344 | H16: of:=RANK([.G16];[.$G$2:.$G$244]) -> 121
A17: 16 | B17: 10 | C17: 833 | D17: 0.700000 | E17: 0.100000 | F17: 0.700000 | G17: 810 | H17: of:=RANK([.G17];[.$G$2:.$G$244]) -> 218
A18: 17 | B18: 10 | C18: 833 | D18: 0.700000 | E18: 0.100000 | F18: 0.800000 | G18: 740 | H18: of:=RANK([.G18];[.$G$2:.$G$244]) -> 231
A19: 18 | B19: 10 | C19: 833 | D19: 0.700000 | E19: 0.100000 | F19: 0.900000 | G19: 731 | H19: of:=RANK([.G19];[.$G$2:.$G$244]) -> 235
A20: 19 | B20: 10 | C20: 833 | D20: 0.800000 | E20: 0.001000 | F20: 0.700000 | G20: 1337 | H20: of:=RANK([.G20];[.$G$2:.$G$244]) -> 124
A21: 20 | B21: 10 | C21: 833 | D21: 0.800000 | E21: 0.001000 | F21: 0.800000 | G21: 1321 | H21: of:=RANK([.G21];[.$G$2:.$G$244]) -> 130
A22: 21 | B22: 10 | C22: 833 | D22: 0.800000 | E22: 0.001000 | F22: 0.900000 | G22: 1371 | H22: of:=RANK([.G22];[.$G$2:.$G$244]) -> 116
A23: 22 | B23: 10 | C23: 833 | D23: 0.800000 | E23: 0.010000 | F23: 0.700000 | G23: 1295 | H23: of:=RANK([.G23];[.$G$2:.$G$244]) -> 135
A24: 23 | B24: 10 | C24: 833 | D24: 0.800000 | E24: 0.010000 | F24: 0.800000 | G24: 1351 | H24: of:=RANK([.G24];[.$G$2:.$G$244]) -> 119
A25: 24 | B25: 10 | C25: 833 | D25: 0.800000 | E25: 0.010000 | F25: 0.900000 | G25: 1292 | H25: of:=RANK([.G25];[.$G$2:.$G$244]) -> 136
A26: 25 | B26: 10 | C26: 833 | D26: 0.800000 | E26: 0.100000 | F26: 0.700000 | G26: 780 | H26: of:=RANK([.G26];[.$G$2:.$G$244]) -> 223
A27: 26 | B27: 10 | C27: 833 | D27: 0.800000 | E27: 0.100000 | F27: 0.800000 | G27: 761 | H27: of:=RANK([.G27];[.$G$2:.$G$244]) -> 230
A28: 27 | B28: 10 | C28: 833 | D28: 0.800000 | E28: 0.100000 | F28: 0.900000 | G28: 724 | H28: of:=RANK([.G28];[.$G$2:.$G$244]) -> 237
A29: 28 | B29: 10 | C29: 1000 | D29: 0.600000 | E29: 0.001000 | F29: 0.700000 | G29: 1333 | H29: of:=RANK([.G29];[.$G$2:.$G$244]) -> 125
A30: 29 | B30: 10 | C30: 1000 | D30: 0.600000 | E30: 0.001000 | F30: 0.800000 | G30: 1281 | H30: of:=RANK([.G30];[.$G$2:.$G$244]) -> 143
A31: 30 | B31: 10 | C31: 1000 | D31: 0.600000 | E31: 0.001000 | F31: 0.900000 | G31: 1348 | H31: of:=RANK([.G31];[.$G$2:.$G$244]) -> 120
A32: 31 | B32: 10 | C32: 1000 | D32: 0.600000 | E32: 0.010000 | F32: 0.700000 | G32: 1309 | H32: of:=RANK([.G32];[.$G$2:.$G$244]) -> 133
A33: 32 | B33: 10 | C33: 1000 | D33: 0.600000 | E33: 0.010000 | F33: 0.800000 | G33: 1423 | H33: of:=RANK([.G33];[.$G$2:.$G$244]) -> 99
A34: 33 | B34: 10 | C34: 1000 | D34: 0.600000 | E34: 0.010000 | F34: 0.900000 | G34: 1259 | H34: of:=RANK([.G34];[.$G$2:.$G$244]) -> 146
A35: 34 | B35: 10 | C35: 1000 | D35: 0.600000 | E35: 0.100000 | F35: 0.700000 | G35: 776 | H35: of:=RANK([.G35];[.$G$2:.$G$244]) -> 225
A36: 35 | B36: 10 | C36: 1000 | D36: 0.600000 | E36: 0.100000 | F36: 0.800000 | G36: 725 | H36: of:=RANK([.G36];[.$G$2:.$G$244]) -> 236
A37: 36 | B37: 10 | C37: 1000 | D37: 0.600000 | E37: 0.100000 | F37: 0.900000 | G37: 694 | H37: of:=RANK([.G37];[.$G$2:.$G$244]) -> 242
A38: 37 | B38: 10 | C38: 1000 | D38: 0.700000 | E38: 0.001000 | F38: 0.700000 | G38: 1233 | H38: of:=RANK([.G38];[.$G$2:.$G$244]) -> 154
A39: 38 | B39: 10 | C39: 1000 | D39: 0.700000 | E39: 0.001000 | F39: 0.800000 | G39: 1258 | H39: of:=RANK([.G39];[.$G$2:.$G$244]) -> 147
A40: 39 | B40: 10 | C40: 1000 | D40: 0.700000 | E40: 0.001000 | F40: 0.900000 | G40: 1354 | H40: of:=RANK([.G40];[.$G$2:.$G$244]) -> 118
A41: 40 | B41: 10 | C41: 1000 | D41: 0.700000 | E41: 0.010000 | F41: 0.700000 | G41: 1321 | H41: of:=RANK([.G41];[.$G$2:.$G$244]) -> 130
A42: 41 | B42: 10 | C42: 1000 | D42: 0.700000 | E42: 0.010000 | F42: 0.800000 | G42: 1286 | H42: of:=RANK([.G42];[.$G$2:.$G$244]) -> 140
A43: 42 | B43: 10 | C43: 1000 | D43: 0.700000 | E43: 0.010000 | F43: 0.900000 | G43: 1282 | H43: of:=RANK([.G43];[.$G$2:.$G$244]) -> 142
A44: 43 | B44: 10 | C44: 1000 | D44: 0.700000 | E44: 0.100000 | F44: 0.700000 | G44: 785 | H44: of:=RANK([.G44];[.$G$2:.$G$244]) -> 222
A45: 44 | B45: 10 | C45: 1000 | D45: 0.700000 | E45: 0.100000 | F45: 0.800000 | G45: 732 | H45: of:=RANK([.G45];[.$G$2:.$G$244]) -> 234
A46: 45 | B46: 10 | C46: 1000 | D46: 0.700000 | E46: 0.100000 | F46: 0.900000 | G46: 703 | H46: of:=RANK([.G46];[.$G$2:.$G$244]) -> 241
A47: 46 | B47: 10 | C47: 1000 | D47: 0.800000 | E47: 0.001000 | F47: 0.700000 | G47: 1242 | H47: of:=RANK([.G47];[.$G$2:.$G$244]) -> 151
A48: 47 | B48: 10 | C48: 1000 | D48: 0.800000 | E48: 0.001000 | F48: 0.800000 | G48: 1424 | H48: of:=RANK([.G48];[.$G$2:.$G$244]) -> 98
A49: 48 | B49: 10 | C49: 1000 | D49: 0.800000 | E49: 0.001000 | F49: 0.900000 | G49: 1211 | H49: of:=RANK([.G49];[.$G$2:.$G$244]) -> 158
A50: 49 | B50: 10 | C50: 1000 | D50: 0.800000 | E50: 0.010000 | F50: 0.700000 | G50: 1426 | H50: of:=RANK([.G50];[.$G$2:.$G$244]) -> 96
A51: 50 | B51: 10 | C51: 1000 | D51: 0.800000 | E51: 0.010000 | F51: 0.800000 | G51: 1374 | H51: of:=RANK([.G51];[.$G$2:.$G$244]) -> 114
A52: 51 | B52: 10 | C52: 1000 | D52: 0.800000 | E52: 0.010000 | F52: 0.900000 | G52: 1300 | H52: of:=RANK([.G52];[.$G$2:.$G$244]) -> 134
A53: 52 | B53: 10 | C53: 1000 | D53: 0.800000 | E53: 0.100000 | F53: 0.700000 | G53: 767 | H53: of:=RANK([.G53];[.$G$2:.$G$244]) -> 228
A54: 53 | B54: 10 | C54: 1000 | D54: 0.800000 | E54: 0.100000 | F54: 0.800000 | G54: 736 | H54: of:=RANK([.G54];[.$G$2:.$G$244]) -> 232
A55: 54 | B55: 10 | C55: 1000 | D55: 0.800000 | E55: 0.100000 | F55: 0.900000 | G55: 722 | H55: of:=RANK([.G55];[.$G$2:.$G$244]) -> 238
A56: 55 | B56: 10 | C56: 1250 | D56: 0.600000 | E56: 0.001000 | F56: 0.700000 | G56: 1205 | H56: of:=RANK([.G56];[.$G$2:.$G$244]) -> 160
A57: 56 | B57: 10 | C57: 1250 | D57: 0.600000 | E57: 0.001000 | F57: 0.800000 | G57: 1232 | H57: of:=RANK([.G57];[.$G$2:.$G$244]) -> 155
A58: 57 | B58: 10 | C58: 1250 | D58: 0.600000 | E58: 0.001000 | F58: 0.900000 | G58: 1193 | H58: of:=RANK([.G58];[.$G$2:.$G$244]) -> 163
A59: 58 | B59: 10 | C59: 1250 | D59: 0.600000 | E59: 0.010000 | F59: 0.700000 | G59: 1245 | H59: of:=RANK([.G59];[.$G$2:.$G$244]) -> 149
A60: 59 | B60: 10 | C60: 1250 | D60: 0.600000 | E60: 0.010000 | F60: 0.800000 | G60: 1204 | H60: of:=RANK([.G60];[.$G$2:.$G$244]) -> 161
A61: 60 | B61: 10 | C61: 1250 | D61: 0.600000 | E61: 0.010000 | F61: 0.900000 | G61: 1321 | H61: of:=RANK([.G61];[.$G$2:.$G$244]) -> 130
A62: 61 | B62: 10 | C62: 1250 | D62: 0.600000 | E62: 0.100000 | F62: 0.700000 | G62: 803 | H62: of:=RANK([.G62];[.$G$2:.$G$244]) -> 220
A63: 62 | B63: 10 | C63: 1250 | D63: 0.600000 | E63: 0.100000 | F63: 0.800000 | G63: 765 | H63: of:=RANK([.G63];[.$G$2:.$G$244]) -> 229
A64: 63 | B64: 10 | C64: 1250 | D64: 0.600000 | E64: 0.100000 | F64: 0.900000 | G64: 718 | H64: of:=RANK([.G64];[.$G$2:.$G$244]) -> 239
A65: 64 | B65: 10 | C65: 1250 | D65: 0.700000 | E65: 0.001000 | F65: 0.700000 | G65: 1207 | H65: of:=RANK([.G65];[.$G$2:.$G$244]) -> 159
A66: 65 | B66: 10 | C66: 1250 | D66: 0.700000 | E66: 0.001000 | F66: 0.800000 | G66: 1161 | H66: of:=RANK([.G66];[.$G$2:.$G$244]) -> 166
A67: 66 | B67: 10 | C67: 1250 | D67: 0.700000 | E67: 0.001000 | F67: 0.900000 | G67: 1158 | H67: of:=RANK([.G67];[.$G$2:.$G$244]) -> 167
A68: 67 | B68: 10 | C68: 1250 | D68: 0.700000 | E68: 0.010000 | F68: 0.700000 | G68: 1265 | H68: of:=RANK([.G68];[.$G$2:.$G$244]) -> 145
A69: 68 | B69: 10 | C69: 1250 | D69: 0.700000 | E69: 0.010000 | F69: 0.800000 | G69: 1256 | H69: of:=RANK([.G69];[.$G$2:.$G$244]) -> 148
A70: 69 | B70: 10 | C70: 1250 | D70: 0.700000 | E70: 0.010000 | F70: 0.900000 | G70: 1222 | H70: of:=RANK([.G70];[.$G$2:.$G$244]) -> 156
A71: 70 | B71: 10 | C71: 1250 | D71: 0.700000 | E71: 0.100000 | F71: 0.700000 | G71: 777 | H71: of:=RANK([.G71];[.$G$2:.$G$244]) -> 224
A72: 71 | B72: 10 | C72: 1250 | D72: 0.700000 | E72: 0.100000 | F72: 0.800000 | G72: 776 | H72: of:=RANK([.G72];[.$G$2:.$G$244]) -> 225
A73: 72 | B73: 10 | C73: 1250 | D73: 0.700000 | E73: 0.100000 | F73: 0.900000 | G73: 736 | H73: of:=RANK([.G73];[.$G$2:.$G$244]) -> 232
A74: 73 | B74: 10 | C74: 1250 | D74: 0.800000 | E74: 0.001000 | F74: 0.700000 | G74: 1291 | H74: of:=RANK([.G74];[.$G$2:.$G$244]) -> 137
A75: 74 | B75: 10 | C75: 1250 | D75: 0.800000 | E75: 0.001000 | F75: 0.800000 | G75: 1241 | H75: of:=RANK([.G75];[.$G$2:.$G$244]) -> 152
A76: 75 | B76: 10 | C76: 1250 | D76: 0.800000 | E76: 0.001000 | F76: 0.900000 | G76: 1340 | H76: of:=RANK([.G76];[.$G$2:.$G$244]) -> 123
A77: 76 | B77: 10 | C77: 1250 | D77: 0.800000 | E77: 0.010000 | F77: 0.700000 | G77: 1324 | H77: of:=RANK([.G77];[.$G$2:.$G$244]) -> 129
A78: 77 | B78: 10 | C78: 1250 | D78: 0.800000 | E78: 0.010000 | F78: 0.800000 | G78: 1331 | H78: of:=RANK([.G78];[.$G$2:.$G$244]) -> 128
A79: 78 | B79: 10 | C79: 1250 | D79: 0.800000 | E79: 0.010000 | F79: 0.900000 | G79: 1290 | H79: of:=RANK([.G79];[.$G$2:.$G$244]) -> 139
A80: 79 | B80: 10 | C80: 1250 | D80: 0.800000 | E80: 0.100000 | F80: 0.700000 | G80: 825 | H80: of:=RANK([.G80];[.$G$2:.$G$244]) -> 216
A81: 80 | B81: 10 | C81: 1250 | D81: 0.800000 | E81: 0.100000 | F81: 0.800000 | G81: 773 | H81: of:=RANK([.G81];[.$G$2:.$G$244]) -> 227
A82: 81 | B82: 10 | C82: 1250 | D82: 0.800000 | E82: 0.100000 | F82: 0.900000 | G82: 709 | H82: of:=RANK([.G82];[.$G$2:.$G$244]) -> 240
A83: 82 | B83: 20 | C83: 833 | D83: 0.600000 | E83: 0.001000 | F83: 0.700000 | G83: 1564 | H83: of:=RANK([.G83];[.$G$2:.$G$244]) -> 49
A84: 83 | B84: 20 | C84: 833 | D84: 0.600000 | E84: 0.001000 | F84: 0.800000 | G84: 1662 | H84: of:=RANK([.G84];[.$G$2:.$G$244]) -> 15
A85: 84 | B85: 20 | C85: 833 | D85: 0.600000 | E85: 0.001000 | F85: 0.900000 | G85: 1767 | H85: of:=RANK([.G85];[.$G$2:.$G$244]) -> 3
A86: 85 | B86: 20 | C86: 833 | D86: 0.600000 | E86: 0.010000 | F86: 0.700000 | G86: 1575 | H86: of:=RANK([.G86];[.$G$2:.$G$244]) -> 45
A87: 86 | B87: 20 | C87: 833 | D87: 0.600000 | E87: 0.010000 | F87: 0.800000 | G87: 1622 | H87: of:=RANK([.G87];[.$G$2:.$G$244]) -> 23
A88: 87 | B88: 20 | C88: 833 | D88: 0.600000 | E88: 0.010000 | F88: 0.900000 | G88: 1586 | H88: of:=RANK([.G88];[.$G$2:.$G$244]) -> 37
A89: 88 | B89: 20 | C89: 833 | D89: 0.600000 | E89: 0.100000 | F89: 0.700000 | G89: 1043 | H89: of:=RANK([.G89];[.$G$2:.$G$244]) -> 179
A90: 89 | B90: 20 | C90: 833 | D90: 0.600000 | E90: 0.100000 | F90: 0.800000 | G90: 964 | H90: of:=RANK([.G90];[.$G$2:.$G$244]) -> 191
A91: 90 | B91: 20 | C91: 833 | D91: 0.600000 | E91: 0.100000 | F91: 0.900000 | G91: 815 | H91: of:=RANK([.G91];[.$G$2:.$G$244]) -> 217
A92: 91 | B92: 20 | C92: 833 | D92: 0.700000 | E92: 0.001000 | F92: 0.700000 | G92: 1560 | H92: of:=RANK([.G92];[.$G$2:.$G$244]) -> 53
A93: 92 | B93: 20 | C93: 833 | D93: 0.700000 | E93: 0.001000 | F93: 0.800000 | G93: 1531 | H93: of:=RANK([.G93];[.$G$2:.$G$244]) -> 62
A94: 93 | B94: 20 | C94: 833 | D94: 0.700000 | E94: 0.001000 | F94: 0.900000 | G94: 1630 | H94: of:=RANK([.G94];[.$G$2:.$G$244]) -> 22
A95: 94 | B95: 20 | C95: 833 | D95: 0.700000 | E95: 0.010000 | F95: 0.700000 | G95: 1680 | H95: of:=RANK([.G95];[.$G$2:.$G$244]) -> 12
A96: 95 | B96: 20 | C96: 833 | D96: 0.700000 | E96: 0.010000 | F96: 0.800000 | G96: 1662 | H96: of:=RANK([.G96];[.$G$2:.$G$244]) -> 15
A97: 96 | B97: 20 | C97: 833 | D97: 0.700000 | E97: 0.010000 | F97: 0.900000 | G97: 1565 | H97: of:=RANK([.G97];[.$G$2:.$G$244]) -> 47
A98: 97 | B98: 20 | C98: 833 | D98: 0.700000 | E98: 0.100000 | F98: 0.700000 | G98: 1023 | H98: of:=RANK([.G98];[.$G$2:.$G$244]) -> 185
A99: 98 | B99: 20 | C99: 833 | D99: 0.700000 | E99: 0.100000 | F99: 0.800000 | G99: 919 | H99: of:=RANK([.G99];[.$G$2:.$G$244]) -> 200
A100: 99 | B100: 20 | C100: 833 | D100: 0.700000 | E100: 0.100000 | F100: 0.900000 | G100: 835 | H100: of:=RANK([.G100];[.$G$2:.$G$244]) -> 214
A101: 100 | B101: 20 | C101: 833 | D101: 0.800000 | E101: 0.001000 | F101: 0.700000 | G101: 1462 | H101: of:=RANK([.G101];[.$G$2:.$G$244]) -> 85
A102: 101 | B102: 20 | C102: 833 | D102: 0.800000 | E102: 0.001000 | F102: 0.800000 | G102: 1534 | H102: of:=RANK([.G102];[.$G$2:.$G$244]) -> 61
A103: 102 | B103: 20 | C103: 833 | D103: 0.800000 | E103: 0.001000 | F103: 0.900000 | G103: 1666 | H103: of:=RANK([.G103];[.$G$2:.$G$244]) -> 13
A104: 103 | B104: 20 | C104: 833 | D104: 0.800000 | E104: 0.010000 | F104: 0.700000 | G104: 1769 | H104: of:=RANK([.G104];[.$G$2:.$G$244]) -> 2
A105: 104 | B105: 20 | C105: 833 | D105: 0.800000 | E105: 0.010000 | F105: 0.800000 | G105: 1564 | H105: of:=RANK([.G105];[.$G$2:.$G$244]) -> 49
A106: 105 | B106: 20 | C106: 833 | D106: 0.800000 | E106: 0.010000 | F106: 0.900000 | G106: 1644 | H106: of:=RANK([.G106];[.$G$2:.$G$244]) -> 20
A107: 106 | B107: 20 | C107: 833 | D107: 0.800000 | E107: 0.100000 | F107: 0.700000 | G107: 1029 | H107: of:=RANK([.G107];[.$G$2:.$G$244]) -> 183
A108: 107 | B108: 20 | C108: 833 | D108: 0.800000 | E108: 0.100000 | F108: 0.800000 | G108: 961 | H108: of:=RANK([.G108];[.$G$2:.$G$244]) -> 192
A109: 108 | B109: 20 | C109: 833 | D109: 0.800000 | E109: 0.100000 | F109: 0.900000 | G109: 833 | H109: of:=RANK([.G109];[.$G$2:.$G$244]) -> 215
A110: 109 | B110: 20 | C110: 1000 | D110: 0.600000 | E110: 0.001000 | F110: 0.700000 | G110: 1333 | H110: of:=RANK([.G110];[.$G$2:.$G$244]) -> 125
A111: 110 | B111: 20 | C111: 1000 | D111: 0.600000 | E111: 0.001000 | F111: 0.800000 | G111: 1556 | H111: of:=RANK([.G111];[.$G$2:.$G$244]) -> 54
A112: 111 | B112: 20 | C112: 1000 | D112: 0.600000 | E112: 0.001000 | F112: 0.900000 | G112: 1576 | H112: of:=RANK([.G112];[.$G$2:.$G$244]) -> 44
A113: 112 | B113: 20 | C113: 1000 | D113: 0.600000 | E113: 0.010000 | F113: 0.700000 | G113: 1561 | H113: of:=RANK([.G113];[.$G$2:.$G$244]) -> 52
A114: 113 | B114: 20 | C114: 1000 | D114: 0.600000 | E114: 0.010000 | F114: 0.800000 | G114: 1487 | H114: of:=RANK([.G114];[.$G$2:.$G$244]) -> 78
A115: 114 | B115: 20 | C115: 1000 | D115: 0.600000 | E115: 0.010000 | F115: 0.900000 | G115: 1587 | H115: of:=RANK([.G115];[.$G$2:.$G$244]) -> 35
A116: 115 | B116: 20 | C116: 1000 | D116: 0.600000 | E116: 0.100000 | F116: 0.700000 | G116: 1093 | H116: of:=RANK([.G116];[.$G$2:.$G$244]) -> 173
A117: 116 | B117: 20 | C117: 1000 | D117: 0.600000 | E117: 0.100000 | F117: 0.800000 | G117: 887 | H117: of:=RANK([.G117];[.$G$2:.$G$244]) -> 206
A118: 117 | B118: 20 | C118: 1000 | D118: 0.600000 | E118: 0.100000 | F118: 0.900000 | G118: 868 | H118: of:=RANK([.G118];[.$G$2:.$G$244]) -> 209
A119: 118 | B119: 20 | C119: 1000 | D119: 0.700000 | E119: 0.001000 | F119: 0.700000 | G119: 1436 | H119: of:=RANK([.G119];[.$G$2:.$G$244]) -> 93
A120: 119 | B120: 20 | C120: 1000 | D120: 0.700000 | E120: 0.001000 | F120: 0.800000 | G120: 1564 | H120: of:=RANK([.G120];[.$G$2:.$G$244]) -> 49
A121: 120 | B121: 20 | C121: 1000 | D121: 0.700000 | E121: 0.001000 | F121: 0.900000 | G121: 1584 | H121: of:=RANK([.G121];[.$G$2:.$G$244]) -> 40
A122: 121 | B122: 20 | C122: 1000 | D122: 0.700000 | E122: 0.010000 | F122: 0.700000 | G122: 1632 | H122: of:=RANK([.G122];[.$G$2:.$G$244]) -> 21
A123: 122 | B123: 20 | C123: 1000 | D123: 0.700000 | E123: 0.010000 | F123: 0.800000 | G123: 1516 | H123: of:=RANK([.G123];[.$G$2:.$G$244]) -> 70
A124: 123 | B124: 20 | C124: 1000 | D124: 0.700000 | E124: 0.010000 | F124: 0.900000 | G124: 1538 | H124: of:=RANK([.G124];[.$G$2:.$G$244]) -> 59
A125: 124 | B125: 20 | C125: 1000 | D125: 0.700000 | E125: 0.100000 | F125: 0.700000 | G125: 1062 | H125: of:=RANK([.G125];[.$G$2:.$G$244]) -> 176
A126: 125 | B126: 20 | C126: 1000 | D126: 0.700000 | E126: 0.100000 | F126: 0.800000 | G126: 960 | H126: of:=RANK([.G126];[.$G$2:.$G$244]) -> 194
A127: 126 | B127: 20 | C127: 1000 | D127: 0.700000 | E127: 0.100000 | F127: 0.900000 | G127: 846 | H127: of:=RANK([.G127];[.$G$2:.$G$244]) -> 212
A128: 127 | B128: 20 | C128: 1000 | D128: 0.800000 | E128: 0.001000 | F128: 0.700000 | G128: 1428 | H128: of:=RANK([.G128];[.$G$2:.$G$244]) -> 95
A129: 128 | B129: 20 | C129: 1000 | D129: 0.800000 | E129: 0.001000 | F129: 0.800000 | G129: 1528 | H129: of:=RANK([.G129];[.$G$2:.$G$244]) -> 63
A130: 129 | B130: 20 | C130: 1000 | D130: 0.800000 | E130: 0.001000 | F130: 0.900000 | G130: 1459 | H130: of:=RANK([.G130];[.$G$2:.$G$244]) -> 86
A131: 130 | B131: 20 | C131: 1000 | D131: 0.800000 | E131: 0.010000 | F131: 0.700000 | G131: 1731 | H131: of:=RANK([.G131];[.$G$2:.$G$244]) -> 4
A132: 131 | B132: 20 | C132: 1000 | D132: 0.800000 | E132: 0.010000 | F132: 0.800000 | G132: 1590 | H132: of:=RANK([.G132];[.$G$2:.$G$244]) -> 33
A133: 132 | B133: 20 | C133: 1000 | D133: 0.800000 | E133: 0.010000 | F133: 0.900000 | G133: 1645 | H133: of:=RANK([.G133];[.$G$2:.$G$244]) -> 18
A134: 133 | B134: 20 | C134: 1000 | D134: 0.800000 | E134: 0.100000 | F134: 0.700000 | G134: 1039 | H134: of:=RANK([.G134];[.$G$2:.$G$244]) -> 180
A135: 134 | B135: 20 | C135: 1000 | D135: 0.800000 | E135: 0.100000 | F135: 0.800000 | G135: 955 | H135: of:=RANK([.G135];[.$G$2:.$G$244]) -> 195
A136: 135 | B136: 20 | C136: 1000 | D136: 0.800000 | E136: 0.100000 | F136: 0.900000 | G136: 856 | H136: of:=RANK([.G136];[.$G$2:.$G$244]) -> 211
A137: 136 | B137: 20 | C137: 1250 | D137: 0.600000 | E137: 0.001000 | F137: 0.700000 | G137: 1291 | H137: of:=RANK([.G137];[.$G$2:.$G$244]) -> 137
A138: 137 | B138: 20 | C138: 1250 | D138: 0.600000 | E138: 0.001000 | F138: 0.800000 | G138: 1446 | H138: of:=RANK([.G138];[.$G$2:.$G$244]) -> 89
A139: 138 | B139: 20 | C139: 1250 | D139: 0.600000 | E139: 0.001000 | F139: 0.900000 | G139: 1483 | H139: of:=RANK([.G139];[.$G$2:.$G$244]) -> 80
A140: 139 | B140: 20 | C140: 1250 | D140: 0.600000 | E140: 0.010000 | F140: 0.700000 | G140: 1504 | H140: of:=RANK([.G140];[.$G$2:.$G$244]) -> 73
A141: 140 | B141: 20 | C141: 1250 | D141: 0.600000 | E141: 0.010000 | F141: 0.800000 | G141: 1459 | H141: of:=RANK([.G141];[.$G$2:.$G$244]) -> 86
A142: 141 | B142: 20 | C142: 1250 | D142: 0.600000 | E142: 0.010000 | F142: 0.900000 | G142: 1600 | H142: of:=RANK([.G142];[.$G$2:.$G$244]) -> 28
A143: 142 | B143: 20 | C143: 1250 | D143: 0.600000 | E143: 0.100000 | F143: 0.700000 | G143: 1125 | H143: of:=RANK([.G143];[.$G$2:.$G$244]) -> 171
A144: 143 | B144: 20 | C144: 1250 | D144: 0.600000 | E144: 0.100000 | F144: 0.800000 | G144: 971 | H144: of:=RANK([.G144];[.$G$2:.$G$244]) -> 189
A145: 144 | B145: 20 | C145: 1250 | D145: 0.600000 | E145: 0.100000 | F145: 0.900000 | G145: 846 | H145: of:=RANK([.G145];[.$G$2:.$G$244]) -> 212
A146: 145 | B146: 20 | C146: 1250 | D146: 0.700000 | E146: 0.001000 | F146: 0.700000 | G146: 1442 | H146: of:=RANK([.G146];[.$G$2:.$G$244]) -> 90
A147: 146 | B147: 20 | C147: 1250 | D147: 0.700000 | E147: 0.001000 | F147: 0.800000 | G147: 1404 | H147: of:=RANK([.G147];[.$G$2:.$G$244]) -> 103
A148: 147 | B148: 20 | C148: 1250 | D148: 0.700000 | E148: 0.001000 | F148: 0.900000 | G148: 1524 | H148: of:=RANK([.G148];[.$G$2:.$G$244]) -> 66
A149: 148 | B149: 20 | C149: 1250 | D149: 0.700000 | E149: 0.010000 | F149: 0.700000 | G149: 1580 | H149: of:=RANK([.G149];[.$G$2:.$G$244]) -> 43
A150: 149 | B150: 20 | C150: 1250 | D150: 0.700000 | E150: 0.010000 | F150: 0.800000 | G150: 1645 | H150: of:=RANK([.G150];[.$G$2:.$G$244]) -> 18
A151: 150 | B151: 20 | C151: 1250 | D151: 0.700000 | E151: 0.010000 | F151: 0.900000 | G151: 1549 | H151: of:=RANK([.G151];[.$G$2:.$G$244]) -> 56
A152: 151 | B152: 20 | C152: 1250 | D152: 0.700000 | E152: 0.100000 | F152: 0.700000 | G152: 1143 | H152: of:=RANK([.G152];[.$G$2:.$G$244]) -> 168
A153: 152 | B153: 20 | C153: 1250 | D153: 0.700000 | E153: 0.100000 | F153: 0.800000 | G153: 961 | H153: of:=RANK([.G153];[.$G$2:.$G$244]) -> 192
A154: 153 | B154: 20 | C154: 1250 | D154: 0.700000 | E154: 0.100000 | F154: 0.900000 | G154: 882 | H154: of:=RANK([.G154];[.$G$2:.$G$244]) -> 207
A155: 154 | B155: 20 | C155: 1250 | D155: 0.800000 | E155: 0.001000 | F155: 0.700000 | G155: 1426 | H155: of:=RANK([.G155];[.$G$2:.$G$244]) -> 96
A156: 155 | B156: 20 | C156: 1250 | D156: 0.800000 | E156: 0.001000 | F156: 0.800000 | G156: 1355 | H156: of:=RANK([.G156];[.$G$2:.$G$244]) -> 117
A157: 156 | B157: 20 | C157: 1250 | D157: 0.800000 | E157: 0.001000 | F157: 0.900000 | G157: 1385 | H157: of:=RANK([.G157];[.$G$2:.$G$244]) -> 109
A158: 157 | B158: 20 | C158: 1250 | D158: 0.800000 | E158: 0.010000 | F158: 0.700000 | G158: 1717 | H158: of:=RANK([.G158];[.$G$2:.$G$244]) -> 5
A159: 158 | B159: 20 | C159: 1250 | D159: 0.800000 | E159: 0.010000 | F159: 0.800000 | G159: 1596 | H159: of:=RANK([.G159];[.$G$2:.$G$244]) -> 30
A160: 159 | B160: 20 | C160: 1250 | D160: 0.800000 | E160: 0.010000 | F160: 0.900000 | G160: 1583 | H160: of:=RANK([.G160];[.$G$2:.$G$244]) -> 41
A161: 160 | B161: 20 | C161: 1250 | D161: 0.800000 | E161: 0.100000 | F161: 0.700000 | G161: 1032 | H161: of:=RANK([.G161];[.$G$2:.$G$244]) -> 182
A162: 161 | B162: 20 | C162: 1250 | D162: 0.800000 | E162: 0.100000 | F162: 0.800000 | G162: 920 | H162: of:=RANK([.G162];[.$G$2:.$G$244]) -> 199
A163: 162 | B163: 20 | C163: 1250 | D163: 0.800000 | E163: 0.100000 | F163: 0.900000 | G163: 860 | H163: of:=RANK([.G163];[.$G$2:.$G$244]) -> 210
A164: 163 | B164: 30 | C164: 833 | D164: 0.600000 | E164: 0.001000 | F164: 0.700000 | G164: 1586 | H164: of:=RANK([.G164];[.$G$2:.$G$244]) -> 37
A165: 164 | B165: 30 | C165: 833 | D165: 0.600000 | E165: 0.001000 | F165: 0.800000 | G165: 1481 | H165: of:=RANK([.G165];[.$G$2:.$G$244]) -> 81
A166: 165 | B166: 30 | C166: 833 | D166: 0.600000 | E166: 0.001000 | F166: 0.900000 | G166: 1541 | H166: of:=RANK([.G166];[.$G$2:.$G$244]) -> 58
A167: 166 | B167: 30 | C167: 833 | D167: 0.600000 | E167: 0.010000 | F167: 0.700000 | G167: 1566 | H167: of:=RANK([.G167];[.$G$2:.$G$244]) -> 46
A168: 167 | B168: 30 | C168: 833 | D168: 0.600000 | E168: 0.010000 | F168: 0.800000 | G168: 1591 | H168: of:=RANK([.G168];[.$G$2:.$G$244]) -> 32
A169: 168 | B169: 30 | C169: 833 | D169: 0.600000 | E169: 0.010000 | F169: 0.900000 | G169: 1519 | H169: of:=RANK([.G169];[.$G$2:.$G$244]) -> 68
A170: 169 | B170: 30 | C170: 833 | D170: 0.600000 | E170: 0.100000 | F170: 0.700000 | G170: 1073 | H170: of:=RANK([.G170];[.$G$2:.$G$244]) -> 175
A171: 170 | B171: 30 | C171: 833 | D171: 0.600000 | E171: 0.100000 | F171: 0.800000 | G171: 1038 | H171: of:=RANK([.G171];[.$G$2:.$G$244]) -> 181
A172: 171 | B172: 30 | C172: 833 | D172: 0.600000 | E172: 0.100000 | F172: 0.900000 | G172: 901 | H172: of:=RANK([.G172];[.$G$2:.$G$244]) -> 203
A173: 172 | B173: 30 | C173: 833 | D173: 0.700000 | E173: 0.001000 | F173: 0.700000 | G173: 1503 | H173: of:=RANK([.G173];[.$G$2:.$G$244]) -> 74
A174: 173 | B174: 30 | C174: 833 | D174: 0.700000 | E174: 0.001000 | F174: 0.800000 | G174: 1613 | H174: of:=RANK([.G174];[.$G$2:.$G$244]) -> 25
A175: 174 | B175: 30 | C175: 833 | D175: 0.700000 | E175: 0.001000 | F175: 0.900000 | G175: 1475 | H175: of:=RANK([.G175];[.$G$2:.$G$244]) -> 83
A176: 175 | B176: 30 | C176: 833 | D176: 0.700000 | E176: 0.010000 | F176: 0.700000 | G176: 1654 | H176: of:=RANK([.G176];[.$G$2:.$G$244]) -> 17
A177: 176 | B177: 30 | C177: 833 | D177: 0.700000 | E177: 0.010000 | F177: 0.800000 | G177: 1614 | H177: of:=RANK([.G177];[.$G$2:.$G$244]) -> 24
A178: 177 | B178: 30 | C178: 833 | D178: 0.700000 | E178: 0.010000 | F178: 0.900000 | G178: 1466 | H178: of:=RANK([.G178];[.$G$2:.$G$244]) -> 84
A179: 178 | B179: 30 | C179: 833 | D179: 0.700000 | E179: 0.100000 | F179: 0.700000 | G179: 1139 | H179: of:=RANK([.G179];[.$G$2:.$G$244]) -> 170
A180: 179 | B180: 30 | C180: 833 | D180: 0.700000 | E180: 0.100000 | F180: 0.800000 | G180: 969 | H180: of:=RANK([.G180];[.$G$2:.$G$244]) -> 190
A181: 180 | B181: 30 | C181: 833 | D181: 0.700000 | E181: 0.100000 | F181: 0.900000 | G181: 895 | H181: of:=RANK([.G181];[.$G$2:.$G$244]) -> 205
A182: 181 | B182: 30 | C182: 833 | D182: 0.800000 | E182: 0.001000 | F182: 0.700000 | G182: 1517 | H182: of:=RANK([.G182];[.$G$2:.$G$244]) -> 69
A183: 182 | B183: 30 | C183: 833 | D183: 0.800000 | E183: 0.001000 | F183: 0.800000 | G183: 1697 | H183: of:=RANK([.G183];[.$G$2:.$G$244]) -> 7
A184: 183 | B184: 30 | C184: 833 | D184: 0.800000 | E184: 0.001000 | F184: 0.900000 | G184: 1521 | H184: of:=RANK([.G184];[.$G$2:.$G$244]) -> 67
A185: 184 | B185: 30 | C185: 833 | D185: 0.800000 | E185: 0.010000 | F185: 0.700000 | G185: 1586 | H185: of:=RANK([.G185];[.$G$2:.$G$244]) -> 37
A186: 185 | B186: 30 | C186: 833 | D186: 0.800000 | E186: 0.010000 | F186: 0.800000 | G186: 1681 | H186: of:=RANK([.G186];[.$G$2:.$G$244]) -> 11
A187: 186 | B187: 30 | C187: 833 | D187: 0.800000 | E187: 0.010000 | F187: 0.900000 | G187: 1581 | H187: of:=RANK([.G187];[.$G$2:.$G$244]) -> 42
A188: 187 | B188: 30 | C188: 833 | D188: 0.800000 | E188: 0.100000 | F188: 0.700000 | G188: 1114 | H188: of:=RANK([.G188];[.$G$2:.$G$244]) -> 172
A189: 188 | B189: 30 | C189: 833 | D189: 0.800000 | E189: 0.100000 | F189: 0.800000 | G189: 1022 | H189: of:=RANK([.G189];[.$G$2:.$G$244]) -> 186
A190: 189 | B190: 30 | C190: 833 | D190: 0.800000 | E190: 0.100000 | F190: 0.900000 | G190: 946 | H190: of:=RANK([.G190];[.$G$2:.$G$244]) -> 197
A191: 190 | B191: 30 | C191: 1000 | D191: 0.600000 | E191: 0.001000 | F191: 0.700000 | G191: 1411 | H191: of:=RANK([.G191];[.$G$2:.$G$244]) -> 102
A192: 191 | B192: 30 | C192: 1000 | D192: 0.600000 | E192: 0.001000 | F192: 0.800000 | G192: 1429 | H192: of:=RANK([.G192];[.$G$2:.$G$244]) -> 94
A193: 192 | B193: 30 | C193: 1000 | D193: 0.600000 | E193: 0.001000 | F193: 0.900000 | G193: 1403 | H193: of:=RANK([.G193];[.$G$2:.$G$244]) -> 104
A194: 193 | B194: 30 | C194: 1000 | D194: 0.600000 | E194: 0.010000 | F194: 0.700000 | G194: 1799 | H194: of:=RANK([.G194];[.$G$2:.$G$244]) -> 1
A195: 194 | B195: 30 | C195: 1000 | D195: 0.600000 | E195: 0.010000 | F195: 0.800000 | G195: 1550 | H195: of:=RANK([.G195];[.$G$2:.$G$244]) -> 55
A196: 195 | B196: 30 | C196: 1000 | D196: 0.600000 | E196: 0.010000 | F196: 0.900000 | G196: 1705 | H196: of:=RANK([.G196];[.$G$2:.$G$244]) -> 6
A197: 196 | B197: 30 | C197: 1000 | D197: 0.600000 | E197: 0.100000 | F197: 0.700000 | G197: 1170 | H197: of:=RANK([.G197];[.$G$2:.$G$244]) -> 165
A198: 197 | B198: 30 | C198: 1000 | D198: 0.600000 | E198: 0.100000 | F198: 0.800000 | G198: 980 | H198: of:=RANK([.G198];[.$G$2:.$G$244]) -> 188
A199: 198 | B199: 30 | C199: 1000 | D199: 0.600000 | E199: 0.100000 | F199: 0.900000 | G199: 948 | H199: of:=RANK([.G199];[.$G$2:.$G$244]) -> 196
A200: 199 | B200: 30 | C200: 1000 | D200: 0.700000 | E200: 0.001000 | F200: 0.700000 | G200: 1542 | H200: of:=RANK([.G200];[.$G$2:.$G$244]) -> 57
A201: 200 | B201: 30 | C201: 1000 | D201: 0.700000 | E201: 0.001000 | F201: 0.800000 | G201: 1486 | H201: of:=RANK([.G201];[.$G$2:.$G$244]) -> 79
A202: 201 | B202: 30 | C202: 1000 | D202: 0.700000 | E202: 0.001000 | F202: 0.900000 | G202: 1608 | H202: of:=RANK([.G202];[.$G$2:.$G$244]) -> 26
A203: 202 | B203: 30 | C203: 1000 | D203: 0.700000 | E203: 0.010000 | F203: 0.700000 | G203: 1602 | H203: of:=RANK([.G203];[.$G$2:.$G$244]) -> 27
A204: 203 | B204: 30 | C204: 1000 | D204: 0.700000 | E204: 0.010000 | F204: 0.800000 | G204: 1689 | H204: of:=RANK([.G204];[.$G$2:.$G$244]) -> 9
A205: 204 | B205: 30 | C205: 1000 | D205: 0.700000 | E205: 0.010000 | F205: 0.900000 | G205: 1596 | H205: of:=RANK([.G205];[.$G$2:.$G$244]) -> 30
A206: 205 | B206: 30 | C206: 1000 | D206: 0.700000 | E206: 0.100000 | F206: 0.700000 | G206: 1190 | H206: of:=RANK([.G206];[.$G$2:.$G$244]) -> 164
A207: 206 | B207: 30 | C207: 1000 | D207: 0.700000 | E207: 0.100000 | F207: 0.800000 | G207: 1093 | H207: of:=RANK([.G207];[.$G$2:.$G$244]) -> 173
A208: 207 | B208: 30 | C208: 1000 | D208: 0.700000 | E208: 0.100000 | F208: 0.900000 | G208: 921 | H208: of:=RANK([.G208];[.$G$2:.$G$244]) -> 198
A209: 208 | B209: 30 | C209: 1000 | D209: 0.800000 | E209: 0.001000 | F209: 0.700000 | G209: 1507 | H209: of:=RANK([.G209];[.$G$2:.$G$244]) -> 71
A210: 209 | B210: 30 | C210: 1000 | D210: 0.800000 | E210: 0.001000 | F210: 0.800000 | G210: 1686 | H210: of:=RANK([.G210];[.$G$2:.$G$244]) -> 10
A211: 210 | B211: 30 | C211: 1000 | D211: 0.800000 | E211: 0.001000 | F211: 0.900000 | G211: 1589 | H211: of:=RANK([.G211];[.$G$2:.$G$244]) -> 34
A212: 211 | B212: 30 | C212: 1000 | D212: 0.800000 | E212: 0.010000 | F212: 0.700000 | G212: 1600 | H212: of:=RANK([.G212];[.$G$2:.$G$244]) -> 28
A213: 212 | B213: 30 | C213: 1000 | D213: 0.800000 | E213: 0.010000 | F213: 0.800000 | G213: 1495 | H213: of:=RANK([.G213];[.$G$2:.$G$244]) -> 77
A214: 213 | B214: 30 | C214: 1000 | D214: 0.800000 | E214: 0.010000 | F214: 0.900000 | G214: 1479 | H214: of:=RANK([.G214];[.$G$2:.$G$244]) -> 82
A215: 214 | B215: 30 | C215: 1000 | D215: 0.800000 | E215: 0.100000 | F215: 0.700000 | G215: 1218 | H215: of:=RANK([.G215];[.$G$2:.$G$244]) -> 157
A216: 215 | B216: 30 | C216: 1000 | D216: 0.800000 | E216: 0.100000 | F216: 0.800000 | G216: 1002 | H216: of:=RANK([.G216];[.$G$2:.$G$244]) -> 187
A217: 216 | B217: 30 | C217: 1000 | D217: 0.800000 | E217: 0.100000 | F217: 0.900000 | G217: 916 | H217: of:=RANK([.G217];[.$G$2:.$G$244]) -> 201
A218: 217 | B218: 30 | C218: 1250 | D218: 0.600000 | E218: 0.001000 | F218: 0.700000 | G218: 1399 | H218: of:=RANK([.G218];[.$G$2:.$G$244]) -> 107
A219: 218 | B219: 30 | C219: 1250 | D219: 0.600000 | E219: 0.001000 | F219: 0.800000 | G219: 1403 | H219: of:=RANK([.G219];[.$G$2:.$G$244]) -> 104
A220: 219 | B220: 30 | C220: 1250 | D220: 0.600000 | E220: 0.001000 | F220: 0.900000 | G220: 1498 | H220: of:=RANK([.G220];[.$G$2:.$G$244]) -> 75
A221: 220 | B221: 30 | C221: 1250 | D221: 0.600000 | E221: 0.010000 | F221: 0.700000 | G221: 1498 | H221: of:=RANK([.G221];[.$G$2:.$G$244]) -> 75
A222: 221 | B222: 30 | C222: 1250 | D222: 0.600000 | E222: 0.010000 | F222: 0.800000 | G222: 1587 | H222: of:=RANK([.G222];[.$G$2:.$G$244]) -> 35
A223: 222 | B223: 30 | C223: 1250 | D223: 0.600000 | E223: 0.010000 | F223: 0.900000 | G223: 1441 | H223: of:=RANK([.G223];[.$G$2:.$G$244]) -> 91
A224: 223 | B224: 30 | C224: 1250 | D224: 0.600000 | E224: 0.100000 | F224: 0.700000 | G224: 1245 | H224: of:=RANK([.G224];[.$G$2:.$G$244]) -> 149
A225: 224 | B225: 30 | C225: 1250 | D225: 0.600000 | E225: 0.100000 | F225: 0.800000 | G225: 1029 | H225: of:=RANK([.G225];[.$G$2:.$G$244]) -> 183
A226: 225 | B226: 30 | C226: 1250 | D226: 0.600000 | E226: 0.100000 | F226: 0.900000 | G226: 881 | H226: of:=RANK([.G226];[.$G$2:.$G$244]) -> 208
A227: 226 | B227: 30 | C227: 1250 | D227: 0.700000 | E227: 0.001000 | F227: 0.700000 | G227: 1381 | H227: of:=RANK([.G227];[.$G$2:.$G$244]) -> 110
A228: 227 | B228: 30 | C228: 1250 | D228: 0.700000 | E228: 0.001000 | F228: 0.800000 | G228: 1415 | H228: of:=RANK([.G228];[.$G$2:.$G$244]) -> 101
A229: 228 | B229: 30 | C229: 1250 | D229: 0.700000 | E229: 0.001000 | F229: 0.900000 | G229: 1439 | H229: of:=RANK([.G229];[.$G$2:.$G$244]) -> 92
A230: 229 | B230: 30 | C230: 1250 | D230: 0.700000 | E230: 0.010000 | F230: 0.700000 | G230: 1507 | H230: of:=RANK([.G230];[.$G$2:.$G$244]) -> 71
A231: 230 | B231: 30 | C231: 1250 | D231: 0.700000 | E231: 0.010000 | F231: 0.800000 | G231: 1695 | H231: of:=RANK([.G231];[.$G$2:.$G$244]) -> 8
A232: 231 | B232: 30 | C232: 1250 | D232: 0.700000 | E232: 0.010000 | F232: 0.900000 | G232: 1535 | H232: of:=RANK([.G232];[.$G$2:.$G$244]) -> 60
A233: 232 | B233: 30 | C233: 1250 | D233: 0.700000 | E233: 0.100000 | F233: 0.700000 | G233: 1141 | H233: of:=RANK([.G233];[.$G$2:.$G$244]) -> 169
A234: 233 | B234: 30 | C234: 1250 | D234: 0.700000 | E234: 0.100000 | F234: 0.800000 | G234: 1047 | H234: of:=RANK([.G234];[.$G$2:.$G$244]) -> 177
A235: 234 | B235: 30 | C235: 1250 | D235: 0.700000 | E235: 0.100000 | F235: 0.900000 | G235: 906 | H235: of:=RANK([.G235];[.$G$2:.$G$244]) -> 202
A236: 235 | B236: 30 | C236: 1250 | D236: 0.800000 | E236: 0.001000 | F236: 0.700000 | G236: 1527 | H236: of:=RANK([.G236];[.$G$2:.$G$244]) -> 65
A237: 236 | B237: 30 | C237: 1250 | D237: 0.800000 | E237: 0.001000 | F237: 0.800000 | G237: 1417 | H237: of:=RANK([.G237];[.$G$2:.$G$244]) -> 100
A238: 237 | B238: 30 | C238: 1250 | D238: 0.800000 | E238: 0.001000 | F238: 0.900000 | G238: 1378 | H238: of:=RANK([.G238];[.$G$2:.$G$244]) -> 112
A239: 238 | B239: 30 | C239: 1250 | D239: 0.800000 | E239: 0.010000 | F239: 0.700000 | G239: 1565 | H239: of:=RANK([.G239];[.$G$2:.$G$244]) -> 47
A240: 239 | B240: 30 | C240: 1250 | D240: 0.800000 | E240: 0.010000 | F240: 0.800000 | G240: 1666 | H240: of:=RANK([.G240];[.$G$2:.$G$244]) -> 13
A241: 240 | B241: 30 | C241: 1250 | D241: 0.800000 | E241: 0.010000 | F241: 0.900000 | G241: 1528 | H241: of:=RANK([.G241];[.$G$2:.$G$244]) -> 63
A242: 241 | B242: 30 | C242: 1250 | D242: 0.800000 | E242: 0.100000 | F242: 0.700000 | G242: 1198 | H242: of:=RANK([.G242];[.$G$2:.$G$244]) -> 162
A243: 242 | B243: 30 | C243: 1250 | D243: 0.800000 | E243: 0.100000 | F243: 0.800000 | G243: 1046 | H243: of:=RANK([.G243];[.$G$2:.$G$244]) -> 178
A244: 243 | B244: 30 | C244: 1250 | D244: 0.800000 | E244: 0.100000 | F244: 0.900000 | G244: 900 | H244: of:=RANK([.G244];[.$G$2:.$G$244]) -> 204