Sheet: Sheet1
A1: Test nr | B1: groupSize | C1: nrOfIndividuals | D1: crossover_ratio | E1: mutation_potency | F1: mutation_ratio | G1: Result | H1: RANK
A2: 1 | B2: 10 | C2: 833 | D2: 0.600000 | E2: 0.001000 | F2: 0.700000 | G2: 903 | H2: =RANK(RC[-1],R2C7:R245C7) -> 115
A3: 2 | B3: 10 | C3: 833 | D3: 0.600000 | E3: 0.001000 | F3: 0.800000 | G3: 903 | H3: =RANK(RC[-1],R2C7:R245C7) -> 115
A4: 3 | B4: 10 | C4: 833 | D4: 0.600000 | E4: 0.001000 | F4: 0.900000 | G4: 948 | H4: =RANK(RC[-1],R2C7:R245C7) -> 94
A5: 4 | B5: 10 | C5: 833 | D5: 0.600000 | E5: 0.010000 | F5: 0.700000 | G5: 897 | H5: =RANK(RC[-1],R2C7:R245C7) -> 119
A6: 5 | B6: 10 | C6: 833 | D6: 0.600000 | E6: 0.010000 | F6: 0.800000 | G6: 890 | H6: =RANK(RC[-1],R2C7:R245C7) -> 120
A7: 6 | B7: 10 | C7: 833 | D7: 0.600000 | E7: 0.010000 | F7: 0.900000 | G7: 850 | H7: =RANK(RC[-1],R2C7:R245C7) -> 143
A8: 7 | B8: 10 | C8: 833 | D8: 0.600000 | E8: 0.100000 | F8: 0.700000 | G8: 555 | H8: =RANK(RC[-1],R2C7:R245C7) -> 225
A9: 8 | B9: 10 | C9: 833 | D9: 0.600000 | E9: 0.100000 | F9: 0.800000 | G9: 546 | H9: =RANK(RC[-1],R2C7:R245C7) -> 228
A10: 9 | B10: 10 | C10: 833 | D10: 0.600000 | E10: 0.100000 | F10: 0.900000 | G10: 494 | H10: =RANK(RC[-1],R2C7:R245C7) -> 243
A11: 10 | B11: 10 | C11: 833 | D11: 0.700000 | E11: 0.001000 | F11: 0.700000 | G11: 960 | H11: =RANK(RC[-1],R2C7:R245C7) -> 87
A12: 11 | B12: 10 | C12: 833 | D12: 0.700000 | E12: 0.001000 | F12: 0.800000 | G12: 889 | H12: =RANK(RC[-1],R2C7:R245C7) -> 122
A13: 12 | B13: 10 | C13: 833 | D13: 0.700000 | E13: 0.001000 | F13: 0.900000 | G13: 955 | H13: =RANK(RC[-1],R2C7:R245C7) -> 89
A14: 13 | B14: 10 | C14: 833 | D14: 0.700000 | E14: 0.010000 | F14: 0.700000 | G14: 899 | H14: =RANK(RC[-1],R2C7:R245C7) -> 118
A15: 14 | B15: 10 | C15: 833 | D15: 0.700000 | E15: 0.010000 | F15: 0.800000 | G15: 901 | H15: =RANK(RC[-1],R2C7:R245C7) -> 117
A16: 15 | B16: 10 | C16: 833 | D16: 0.700000 | E16: 0.010000 | F16: 0.900000 | G16: 862 | H16: =RANK(RC[-1],R2C7:R245C7) -> 137
A17: 16 | B17: 10 | C17: 833 | D17: 0.700000 | E17: 0.100000 | F17: 0.700000 | G17: 579 | H17: =RANK(RC[-1],R2C7:R245C7) -> 217
A18: 17 | B18: 10 | C18: 833 | D18: 0.700000 | E18: 0.100000 | F18: 0.800000 | G18: 520 | H18: =RANK(RC[-1],R2C7:R245C7) -> 235
A19: 18 | B19: 10 | C19: 833 | D19: 0.700000 | E19: 0.100000 | F19: 0.900000 | G19: 506 | H19: =RANK(RC[-1],R2C7:R245C7) -> 241
A20: 19 | B20: 10 | C20: 833 | D20: 0.800000 | E20: 0.001000 | F20: 0.700000 | G20: 881 | H20: =RANK(RC[-1],R2C7:R245C7) -> 128
A21: 20 | B21: 10 | C21: 833 | D21: 0.800000 | E21: 0.001000 | F21: 0.800000 | G21: 977 | H21: =RANK(RC[-1],R2C7:R245C7) -> 72
A22: 21 | B22: 10 | C22: 833 | D22: 0.800000 | E22: 0.001000 | F22: 0.900000 | G22: 884 | H22: =RANK(RC[-1],R2C7:R245C7) -> 125
A23: 22 | B23: 10 | C23: 833 | D23: 0.800000 | E23: 0.010000 | F23: 0.700000 | G23: 854 | H23: =RANK(RC[-1],R2C7:R245C7) -> 139
A24: 23 | B24: 10 | C24: 833 | D24: 0.800000 | E24: 0.010000 | F24: 0.800000 | G24: 864 | H24: =RANK(RC[-1],R2C7:R245C7) -> 135
A25: 24 | B25: 10 | C25: 833 | D25: 0.800000 | E25: 0.010000 | F25: 0.900000 | G25: 858 | H25: =RANK(RC[-1],R2C7:R245C7) -> 138
A26: 25 | B26: 10 | C26: 833 | D26: 0.800000 | E26: 0.100000 | F26: 0.700000 | G26: 576 | H26: =RANK(RC[-1],R2C7:R245C7) -> 218
A27: 26 | B27: 10 | C27: 833 | D27: 0.800000 | E27: 0.100000 | F27: 0.800000 | G27: 553 | H27: =RANK(RC[-1],R2C7:R245C7) -> 227
A28: 27 | B28: 10 | C28: 833 | D28: 0.800000 | E28: 0.100000 | F28: 0.900000 | G28: 516 | H28: =RANK(RC[-1],R2C7:R245C7) -> 237
A29: 28 | B29: 10 | C29: 1000 | D29: 0.600000 | E29: 0.001000 | F29: 0.700000 | G29: 825 | H29: =RANK(RC[-1],R2C7:R245C7) -> 152
A30: 29 | B30: 10 | C30: 1000 | D30: 0.600000 | E30: 0.001000 | F30: 0.800000 | G30: 885 | H30: =RANK(RC[-1],R2C7:R245C7) -> 124
A31: 30 | B31: 10 | C31: 1000 | D31: 0.600000 | E31: 0.001000 | F31: 0.900000 | G31: 844 | H31: =RANK(RC[-1],R2C7:R245C7) -> 144
A32: 31 | B32: 10 | C32: 1000 | D32: 0.600000 | E32: 0.010000 | F32: 0.700000 | G32: 868 | H32: =RANK(RC[-1],R2C7:R245C7) -> 130
A33: 32 | B33: 10 | C33: 1000 | D33: 0.600000 | E33: 0.010000 | F33: 0.800000 | G33: 836 | H33: =RANK(RC[-1],R2C7:R245C7) -> 146
A34: 33 | B34: 10 | C34: 1000 | D34: 0.600000 | E34: 0.010000 | F34: 0.900000 | G34: 853 | H34: =RANK(RC[-1],R2C7:R245C7) -> 141
A35: 34 | B35: 10 | C35: 1000 | D35: 0.600000 | E35: 0.100000 | F35: 0.700000 | G35: 554 | H35: =RANK(RC[-1],R2C7:R245C7) -> 226
A36: 35 | B36: 10 | C36: 1000 | D36: 0.600000 | E36: 0.100000 | F36: 0.800000 | G36: 525 | H36: =RANK(RC[-1],R2C7:R245C7) -> 233
A37: 36 | B37: 10 | C37: 1000 | D37: 0.600000 | E37: 0.100000 | F37: 0.900000 | G37: 514 | H37: =RANK(RC[-1],R2C7:R245C7) -> 239
A38: 37 | B38: 10 | C38: 1000 | D38: 0.700000 | E38: 0.001000 | F38: 0.700000 | G38: 868 | H38: =RANK(RC[-1],R2C7:R245C7) -> 130
A39: 38 | B39: 10 | C39: 1000 | D39: 0.700000 | E39: 0.001000 | F39: 0.800000 | G39: 865 | H39: =RANK(RC[-1],R2C7:R245C7) -> 134
A40: 39 | B40: 10 | C40: 1000 | D40: 0.700000 | E40: 0.001000 | F40: 0.900000 | G40: 829 | H40: =RANK(RC[-1],R2C7:R245C7) -> 149
A41: 40 | B41: 10 | C41: 1000 | D41: 0.700000 | E41: 0.010000 | F41: 0.700000 | G41: 912 | H41: =RANK(RC[-1],R2C7:R245C7) -> 113
A42: 41 | B42: 10 | C42: 1000 | D42: 0.700000 | E42: 0.010000 | F42: 0.800000 | G42: 947 | H42: =RANK(RC[-1],R2C7:R245C7) -> 95
A43: 42 | B43: 10 | C43: 1000 | D43: 0.700000 | E43: 0.010000 | F43: 0.900000 | G43: 823 | H43: =RANK(RC[-1],R2C7:R245C7) -> 154
A44: 43 | B44: 10 | C44: 1000 | D44: 0.700000 | E44: 0.100000 | F44: 0.700000 | G44: 568 | H44: =RANK(RC[-1],R2C7:R245C7) -> 222
A45: 44 | B45: 10 | C45: 1000 | D45: 0.700000 | E45: 0.100000 | F45: 0.800000 | G45: 525 | H45: =RANK(RC[-1],R2C7:R245C7) -> 233
A46: 45 | B46: 10 | C46: 1000 | D46: 0.700000 | E46: 0.100000 | F46: 0.900000 | G46: 517 | H46: =RANK(RC[-1],R2C7:R245C7) -> 236
A47: 46 | B47: 10 | C47: 1000 | D47: 0.800000 | E47: 0.001000 | F47: 0.700000 | G47: 832 | H47: =RANK(RC[-1],R2C7:R245C7) -> 147
A48: 47 | B48: 10 | C48: 1000 | D48: 0.800000 | E48: 0.001000 | F48: 0.800000 | G48: 890 | H48: =RANK(RC[-1],R2C7:R245C7) -> 120
A49: 48 | B49: 10 | C49: 1000 | D49: 0.800000 | E49: 0.001000 | F49: 0.900000 | G49: 864 | H49: =RANK(RC[-1],R2C7:R245C7) -> 135
A50: 49 | B50: 10 | C50: 1000 | D50: 0.800000 | E50: 0.010000 | F50: 0.700000 | G50: 910 | H50: =RANK(RC[-1],R2C7:R245C7) -> 114
A51: 50 | B51: 10 | C51: 1000 | D51: 0.800000 | E51: 0.010000 | F51: 0.800000 | G51: 883 | H51: =RANK(RC[-1],R2C7:R245C7) -> 127
A52: 51 | B52: 10 | C52: 1000 | D52: 0.800000 | E52: 0.010000 | F52: 0.900000 | G52: 811 | H52: =RANK(RC[-1],R2C7:R245C7) -> 160
A53: 52 | B53: 10 | C53: 1000 | D53: 0.800000 | E53: 0.100000 | F53: 0.700000 | G53: 558 | H53: =RANK(RC[-1],R2C7:R245C7) -> 224
A54: 53 | B54: 10 | C54: 1000 | D54: 0.800000 | E54: 0.100000 | F54: 0.800000 | G54: 533 | H54: =RANK(RC[-1],R2C7:R245C7) -> 230
A55: 54 | B55: 10 | C55: 1000 | D55: 0.800000 | E55: 0.100000 | F55: 0.900000 | G55: 528 | H55: =RANK(RC[-1],R2C7:R245C7) -> 232
A56: 55 | B56: 10 | C56: 1250 | D56: 0.600000 | E56: 0.001000 | F56: 0.700000 | G56: 799 | H56: =RANK(RC[-1],R2C7:R245C7) -> 166
A57: 56 | B57: 10 | C57: 1250 | D57: 0.600000 | E57: 0.001000 | F57: 0.800000 | G57: 776 | H57: =RANK(RC[-1],R2C7:R245C7) -> 171
A58: 57 | B58: 10 | C58: 1250 | D58: 0.600000 | E58: 0.001000 | F58: 0.900000 | G58: 797 | H58: =RANK(RC[-1],R2C7:R245C7) -> 167
A59: 58 | B59: 10 | C59: 1250 | D59: 0.600000 | E59: 0.010000 | F59: 0.700000 | G59: 866 | H59: =RANK(RC[-1],R2C7:R245C7) -> 132
A60: 59 | B60: 10 | C60: 1250 | D60: 0.600000 | E60: 0.010000 | F60: 0.800000 | G60: 807 | H60: =RANK(RC[-1],R2C7:R245C7) -> 162
A61: 60 | B61: 10 | C61: 1250 | D61: 0.600000 | E61: 0.010000 | F61: 0.900000 | G61: 807 | H61: =RANK(RC[-1],R2C7:R245C7) -> 162
A62: 61 | B62: 10 | C62: 1250 | D62: 0.600000 | E62: 0.100000 | F62: 0.700000 | G62: 569 | H62: =RANK(RC[-1],R2C7:R245C7) -> 221
A63: 62 | B63: 10 | C63: 1250 | D63: 0.600000 | E63: 0.100000 | F63: 0.800000 | G63: 543 | H63: =RANK(RC[-1],R2C7:R245C7) -> 229
A64: 63 | B64: 10 | C64: 1250 | D64: 0.600000 | E64: 0.100000 | F64: 0.900000 | G64: 501 | H64: =RANK(RC[-1],R2C7:R245C7) -> 242
A65: 64 | B65: 10 | C65: 1250 | D65: 0.700000 | E65: 0.001000 | F65: 0.700000 | G65: 725 | H65: =RANK(RC[-1],R2C7:R245C7) -> 181
A66: 65 | B66: 10 | C66: 1250 | D66: 0.700000 | E66: 0.001000 | F66: 0.800000 | G66: 821 | H66: =RANK(RC[-1],R2C7:R245C7) -> 156
A67: 66 | B67: 10 | C67: 1250 | D67: 0.700000 | E67: 0.001000 | F67: 0.900000 | G67: 800 | H67: =RANK(RC[-1],R2C7:R245C7) -> 165
A68: 67 | B68: 10 | C68: 1250 | D68: 0.700000 | E68: 0.010000 | F68: 0.700000 | G68: 870 | H68: =RANK(RC[-1],R2C7:R245C7) -> 129
A69: 68 | B69: 10 | C69: 1250 | D69: 0.700000 | E69: 0.010000 | F69: 0.800000 | G69: 813 | H69: =RANK(RC[-1],R2C7:R245C7) -> 159
A70: 69 | B70: 10 | C70: 1250 | D70: 0.700000 | E70: 0.010000 | F70: 0.900000 | G70: 887 | H70: =RANK(RC[-1],R2C7:R245C7) -> 123
A71: 70 | B71: 10 | C71: 1250 | D71: 0.700000 | E71: 0.100000 | F71: 0.700000 | G71: 573 | H71: =RANK(RC[-1],R2C7:R245C7) -> 220
A72: 71 | B72: 10 | C72: 1250 | D72: 0.700000 | E72: 0.100000 | F72: 0.800000 | G72: 559 | H72: =RANK(RC[-1],R2C7:R245C7) -> 223
A73: 72 | B73: 10 | C73: 1250 | D73: 0.700000 | E73: 0.100000 | F73: 0.900000 | G73: 516 | H73: =RANK(RC[-1],R2C7:R245C7) -> 237
A74: 73 | B74: 10 | C74: 1250 | D74: 0.800000 | E74: 0.001000 | F74: 0.700000 | G74: 822 | H74: =RANK(RC[-1],R2C7:R245C7) -> 155
A75: 74 | B75: 10 | C75: 1250 | D75: 0.800000 | E75: 0.001000 | F75: 0.800000 | G75: 788 | H75: =RANK(RC[-1],R2C7:R245C7) -> 169
A76: 75 | B76: 10 | C76: 1250 | D76: 0.800000 | E76: 0.001000 | F76: 0.900000 | G76: 763 | H76: =RANK(RC[-1],R2C7:R245C7) -> 174
A77: 76 | B77: 10 | C77: 1250 | D77: 0.800000 | E77: 0.010000 | F77: 0.700000 | G77: 854 | H77: =RANK(RC[-1],R2C7:R245C7) -> 139
A78: 77 | B78: 10 | C78: 1250 | D78: 0.800000 | E78: 0.010000 | F78: 0.800000 | G78: 829 | H78: =RANK(RC[-1],R2C7:R245C7) -> 149
A79: 78 | B79: 10 | C79: 1250 | D79: 0.800000 | E79: 0.010000 | F79: 0.900000 | G79: 821 | H79: =RANK(RC[-1],R2C7:R245C7) -> 156
A80: 79 | B80: 10 | C80: 1250 | D80: 0.800000 | E80: 0.100000 | F80: 0.700000 | G80: 580 | H80: =RANK(RC[-1],R2C7:R245C7) -> 216
A81: 80 | B81: 10 | C81: 1250 | D81: 0.800000 | E81: 0.100000 | F81: 0.800000 | G81: 529 | H81: =RANK(RC[-1],R2C7:R245C7) -> 231
A82: 81 | B82: 10 | C82: 1250 | D82: 0.800000 | E82: 0.100000 | F82: 0.900000 | G82: 512 | H82: =RANK(RC[-1],R2C7:R245C7) -> 240
A83: 82 | B83: 20 | C83: 833 | D83: 0.600000 | E83: 0.001000 | F83: 0.700000 | G83: 1005 | H83: =RANK(RC[-1],R2C7:R245C7) -> 36
A84: 83 | B84: 20 | C84: 833 | D84: 0.600000 | E84: 0.001000 | F84: 0.800000 | G84: 1062 | H84: =RANK(RC[-1],R2C7:R245C7) -> 7
A85: 84 | B85: 20 | C85: 833 | D85: 0.600000 | E85: 0.001000 | F85: 0.900000 | G85: 987 | H85: =RANK(RC[-1],R2C7:R245C7) -> 55
A86: 85 | B86: 20 | C86: 833 | D86: 0.600000 | E86: 0.010000 | F86: 0.700000 | G86: 972 | H86: =RANK(RC[-1],R2C7:R245C7) -> 77
A87: 86 | B87: 20 | C87: 833 | D87: 0.600000 | E87: 0.010000 | F87: 0.800000 | G87: 988 | H87: =RANK(RC[-1],R2C7:R245C7) -> 53
A88: 87 | B88: 20 | C88: 833 | D88: 0.600000 | E88: 0.010000 | F88: 0.900000 | G88: 944 | H88: =RANK(RC[-1],R2C7:R245C7) -> 96
A89: 88 | B89: 20 | C89: 833 | D89: 0.600000 | E89: 0.100000 | F89: 0.700000 | G89: 769 | H89: =RANK(RC[-1],R2C7:R245C7) -> 173
A90: 89 | B90: 20 | C90: 833 | D90: 0.600000 | E90: 0.100000 | F90: 0.800000 | G90: 638 | H90: =RANK(RC[-1],R2C7:R245C7) -> 200
A91: 90 | B91: 20 | C91: 833 | D91: 0.600000 | E91: 0.100000 | F91: 0.900000 | G91: 593 | H91: =RANK(RC[-1],R2C7:R245C7) -> 212
A92: 91 | B92: 20 | C92: 833 | D92: 0.700000 | E92: 0.001000 | F92: 0.700000 | G92: 1036 | H92: =RANK(RC[-1],R2C7:R245C7) -> 17
A93: 92 | B93: 20 | C93: 833 | D93: 0.700000 | E93: 0.001000 | F93: 0.800000 | G93: 1023 | H93: =RANK(RC[-1],R2C7:R245C7) -> 26
A94: 93 | B94: 20 | C94: 833 | D94: 0.700000 | E94: 0.001000 | F94: 0.900000 | G94: 1073 | H94: =RANK(RC[-1],R2C7:R245C7) -> 4
A95: 94 | B95: 20 | C95: 833 | D95: 0.700000 | E95: 0.010000 | F95: 0.700000 | G95: 973 | H95: =RANK(RC[-1],R2C7:R245C7) -> 76
A96: 95 | B96: 20 | C96: 833 | D96: 0.700000 | E96: 0.010000 | F96: 0.800000 | G96: 1004 | H96: =RANK(RC[-1],R2C7:R245C7) -> 39
A97: 96 | B97: 20 | C97: 833 | D97: 0.700000 | E97: 0.010000 | F97: 0.900000 | G97: 979 | H97: =RANK(RC[-1],R2C7:R245C7) -> 66
A98: 97 | B98: 20 | C98: 833 | D98: 0.700000 | E98: 0.100000 | F98: 0.700000 | G98: 740 | H98: =RANK(RC[-1],R2C7:R245C7) -> 179
A99: 98 | B99: 20 | C99: 833 | D99: 0.700000 | E99: 0.100000 | F99: 0.800000 | G99: 642 | H99: =RANK(RC[-1],R2C7:R245C7) -> 198
A100: 99 | B100: 20 | C100: 833 | D100: 0.700000 | E100: 0.100000 | F100: 0.900000 | G100: 576 | H100: =RANK(RC[-1],R2C7:R245C7) -> 218
A101: 100 | B101: 20 | C101: 833 | D101: 0.800000 | E101: 0.001000 | F101: 0.700000 | G101: 1027 | H101: =RANK(RC[-1],R2C7:R245C7) -> 23
A102: 101 | B102: 20 | C102: 833 | D102: 0.800000 | E102: 0.001000 | F102: 0.800000 | G102: 1083 | H102: =RANK(RC[-1],R2C7:R245C7) -> 2
A103: 102 | B103: 20 | C103: 833 | D103: 0.800000 | E103: 0.001000 | F103: 0.900000 | G103: 1052 | H103: =RANK(RC[-1],R2C7:R245C7) -> 10
A104: 103 | B104: 20 | C104: 833 | D104: 0.800000 | E104: 0.010000 | F104: 0.700000 | G104: 959 | H104: =RANK(RC[-1],R2C7:R245C7) -> 88
A105: 104 | B105: 20 | C105: 833 | D105: 0.800000 | E105: 0.010000 | F105: 0.800000 | G105: 976 | H105: =RANK(RC[-1],R2C7:R245C7) -> 73
A106: 105 | B106: 20 | C106: 833 | D106: 0.800000 | E106: 0.010000 | F106: 0.900000 | G106: 952 | H106: =RANK(RC[-1],R2C7:R245C7) -> 93
A107: 106 | B107: 20 | C107: 833 | D107: 0.800000 | E107: 0.100000 | F107: 0.700000 | G107: 699 | H107: =RANK(RC[-1],R2C7:R245C7) -> 188
A108: 107 | B108: 20 | C108: 833 | D108: 0.800000 | E108: 0.100000 | F108: 0.800000 | G108: 635 | H108: =RANK(RC[-1],R2C7:R245C7) -> 202
A109: 108 | B109: 20 | C109: 833 | D109: 0.800000 | E109: 0.100000 | F109: 0.900000 | G109: 600 | H109: =RANK(RC[-1],R2C7:R245C7) -> 210
A110: 109 | B110: 20 | C110: 1000 | D110: 0.600000 | E110: 0.001000 | F110: 0.700000 | G110: 978 | H110: =RANK(RC[-1],R2C7:R245C7) -> 67
A111: 110 | B111: 20 | C111: 1000 | D111: 0.600000 | E111: 0.001000 | F111: 0.800000 | G111: 981 | H111: =RANK(RC[-1],R2C7:R245C7) -> 60
A112: 111 | B112: 20 | C112: 1000 | D112: 0.600000 | E112: 0.001000 | F112: 0.900000 | G112: 982 | H112: =RANK(RC[-1],R2C7:R245C7) -> 59
A113: 112 | B113: 20 | C113: 1000 | D113: 0.600000 | E113: 0.010000 | F113: 0.700000 | G113: 1050 | H113: =RANK(RC[-1],R2C7:R245C7) -> 11
A114: 113 | B114: 20 | C114: 1000 | D114: 0.600000 | E114: 0.010000 | F114: 0.800000 | G114: 1011 | H114: =RANK(RC[-1],R2C7:R245C7) -> 33
A115: 114 | B115: 20 | C115: 1000 | D115: 0.600000 | E115: 0.010000 | F115: 0.900000 | G115: 961 | H115: =RANK(RC[-1],R2C7:R245C7) -> 85
A116: 115 | B116: 20 | C116: 1000 | D116: 0.600000 | E116: 0.100000 | F116: 0.700000 | G116: 755 | H116: =RANK(RC[-1],R2C7:R245C7) -> 175
A117: 116 | B117: 20 | C117: 1000 | D117: 0.600000 | E117: 0.100000 | F117: 0.800000 | G117: 669 | H117: =RANK(RC[-1],R2C7:R245C7) -> 193
A118: 117 | B118: 20 | C118: 1000 | D118: 0.600000 | E118: 0.100000 | F118: 0.900000 | G118: 591 | H118: =RANK(RC[-1],R2C7:R245C7) -> 213
A119: 118 | B119: 20 | C119: 1000 | D119: 0.700000 | E119: 0.001000 | F119: 0.700000 | G119: 996 | H119: =RANK(RC[-1],R2C7:R245C7) -> 46
A120: 119 | B120: 20 | C120: 1000 | D120: 0.700000 | E120: 0.001000 | F120: 0.800000 | G120: 994 | H120: =RANK(RC[-1],R2C7:R245C7) -> 48
A121: 120 | B121: 20 | C121: 1000 | D121: 0.700000 | E121: 0.001000 | F121: 0.900000 | G121: 988 | H121: =RANK(RC[-1],R2C7:R245C7) -> 53
A122: 121 | B122: 20 | C122: 1000 | D122: 0.700000 | E122: 0.010000 | F122: 0.700000 | G122: 981 | H122: =RANK(RC[-1],R2C7:R245C7) -> 60
A123: 122 | B123: 20 | C123: 1000 | D123: 0.700000 | E123: 0.010000 | F123: 0.800000 | G123: 995 | H123: =RANK(RC[-1],R2C7:R245C7) -> 47
A124: 123 | B124: 20 | C124: 1000 | D124: 0.700000 | E124: 0.010000 | F124: 0.900000 | G124: 968 | H124: =RANK(RC[-1],R2C7:R245C7) -> 80
A125: 124 | B125: 20 | C125: 1000 | D125: 0.700000 | E125: 0.100000 | F125: 0.700000 | G125: 702 | H125: =RANK(RC[-1],R2C7:R245C7) -> 186
A126: 125 | B126: 20 | C126: 1000 | D126: 0.700000 | E126: 0.100000 | F126: 0.800000 | G126: 647 | H126: =RANK(RC[-1],R2C7:R245C7) -> 197
A127: 126 | B127: 20 | C127: 1000 | D127: 0.700000 | E127: 0.100000 | F127: 0.900000 | G127: 589 | H127: =RANK(RC[-1],R2C7:R245C7) -> 214
A128: 127 | B128: 20 | C128: 1000 | D128: 0.800000 | E128: 0.001000 | F128: 0.700000 | G128: 939 | H128: =RANK(RC[-1],R2C7:R245C7) -> 98
A129: 128 | B129: 20 | C129: 1000 | D129: 0.800000 | E129: 0.001000 | F129: 0.800000 | G129: 992 | H129: =RANK(RC[-1],R2C7:R245C7) -> 49
A130: 129 | B130: 20 | C130: 1000 | D130: 0.800000 | E130: 0.001000 | F130: 0.900000 | G130: 1008 | H130: =RANK(RC[-1],R2C7:R245C7) -> 35
A131: 130 | B131: 20 | C131: 1000 | D131: 0.800000 | E131: 0.010000 | F131: 0.700000 | G131: 971 | H131: =RANK(RC[-1],R2C7:R245C7) -> 78
A132: 131 | B132: 20 | C132: 1000 | D132: 0.800000 | E132: 0.010000 | F132: 0.800000 | G132: 991 | H132: =RANK(RC[-1],R2C7:R245C7) -> 50
A133: 132 | B133: 20 | C133: 1000 | D133: 0.800000 | E133: 0.010000 | F133: 0.900000 | G133: 937 | H133: =RANK(RC[-1],R2C7:R245C7) -> 102
A134: 133 | B134: 20 | C134: 1000 | D134: 0.800000 | E134: 0.100000 | F134: 0.700000 | G134: 790 | H134: =RANK(RC[-1],R2C7:R245C7) -> 168
A135: 134 | B135: 20 | C135: 1000 | D135: 0.800000 | E135: 0.100000 | F135: 0.800000 | G135: 672 | H135: =RANK(RC[-1],R2C7:R245C7) -> 191
A136: 135 | B136: 20 | C136: 1000 | D136: 0.800000 | E136: 0.100000 | F136: 0.900000 | G136: 604 | H136: =RANK(RC[-1],R2C7:R245C7) -> 209
A137: 136 | B137: 20 | C137: 1250 | D137: 0.600000 | E137: 0.001000 | F137: 0.700000 | G137: 920 | H137: =RANK(RC[-1],R2C7:R245C7) -> 110
A138: 137 | B138: 20 | C138: 1250 | D138: 0.600000 | E138: 0.001000 | F138: 0.800000 | G138: 916 | H138: =RANK(RC[-1],R2C7:R245C7) -> 111
A139: 138 | B139: 20 | C139: 1250 | D139: 0.600000 | E139: 0.001000 | F139: 0.900000 | G139: 961 | H139: =RANK(RC[-1],R2C7:R245C7) -> 85
A140: 139 | B140: 20 | C140: 1250 | D140: 0.600000 | E140: 0.010000 | F140: 0.700000 | G140: 962 | H140: =RANK(RC[-1],R2C7:R245C7) -> 84
A141: 140 | B141: 20 | C141: 1250 | D141: 0.600000 | E141: 0.010000 | F141: 0.800000 | G141: 965 | H141: =RANK(RC[-1],R2C7:R245C7) -> 83
A142: 141 | B142: 20 | C142: 1250 | D142: 0.600000 | E142: 0.010000 | F142: 0.900000 | G142: 939 | H142: =RANK(RC[-1],R2C7:R245C7) -> 98
A143: 142 | B143: 20 | C143: 1250 | D143: 0.600000 | E143: 0.100000 | F143: 0.700000 | G143: 784 | H143: =RANK(RC[-1],R2C7:R245C7) -> 170
A144: 143 | B144: 20 | C144: 1250 | D144: 0.600000 | E144: 0.100000 | F144: 0.800000 | G144: 651 | H144: =RANK(RC[-1],R2C7:R245C7) -> 196
A145: 144 | B145: 20 | C145: 1250 | D145: 0.600000 | E145: 0.100000 | F145: 0.900000 | G145: 586 | H145: =RANK(RC[-1],R2C7:R245C7) -> 215
A146: 145 | B146: 20 | C146: 1250 | D146: 0.700000 | E146: 0.001000 | F146: 0.700000 | G146: 978 | H146: =RANK(RC[-1],R2C7:R245C7) -> 67
A147: 146 | B147: 20 | C147: 1250 | D147: 0.700000 | E147: 0.001000 | F147: 0.800000 | G147: 928 | H147: =RANK(RC[-1],R2C7:R245C7) -> 106
A148: 147 | B148: 20 | C148: 1250 | D148: 0.700000 | E148: 0.001000 | F148: 0.900000 | G148: 930 | H148: =RANK(RC[-1],R2C7:R245C7) -> 105
A149: 148 | B149: 20 | C149: 1250 | D149: 0.700000 | E149: 0.010000 | F149: 0.700000 | G149: 981 | H149: =RANK(RC[-1],R2C7:R245C7) -> 60
A150: 149 | B150: 20 | C150: 1250 | D150: 0.700000 | E150: 0.010000 | F150: 0.800000 | G150: 925 | H150: =RANK(RC[-1],R2C7:R245C7) -> 109
A151: 150 | B151: 20 | C151: 1250 | D151: 0.700000 | E151: 0.010000 | F151: 0.900000 | G151: 933 | H151: =RANK(RC[-1],R2C7:R245C7) -> 104
A152: 151 | B152: 20 | C152: 1250 | D152: 0.700000 | E152: 0.100000 | F152: 0.700000 | G152: 774 | H152: =RANK(RC[-1],R2C7:R245C7) -> 172
A153: 152 | B153: 20 | C153: 1250 | D153: 0.700000 | E153: 0.100000 | F153: 0.800000 | G153: 641 | H153: =RANK(RC[-1],R2C7:R245C7) -> 199
A154: 153 | B154: 20 | C154: 1250 | D154: 0.700000 | E154: 0.100000 | F154: 0.900000 | G154: 599 | H154: =RANK(RC[-1],R2C7:R245C7) -> 211
A155: 154 | B155: 20 | C155: 1250 | D155: 0.800000 | E155: 0.001000 | F155: 0.700000 | G155: 884 | H155: =RANK(RC[-1],R2C7:R245C7) -> 125
A156: 155 | B156: 20 | C156: 1250 | D156: 0.800000 | E156: 0.001000 | F156: 0.800000 | G156: 955 | H156: =RANK(RC[-1],R2C7:R245C7) -> 89
A157: 156 | B157: 20 | C157: 1250 | D157: 0.800000 | E157: 0.001000 | F157: 0.900000 | G157: 975 | H157: =RANK(RC[-1],R2C7:R245C7) -> 74
A158: 157 | B158: 20 | C158: 1250 | D158: 0.800000 | E158: 0.010000 | F158: 0.700000 | G158: 937 | H158: =RANK(RC[-1],R2C7:R245C7) -> 102
A159: 158 | B159: 20 | C159: 1250 | D159: 0.800000 | E159: 0.010000 | F159: 0.800000 | G159: 978 | H159: =RANK(RC[-1],R2C7:R245C7) -> 67
A160: 159 | B160: 20 | C160: 1250 | D160: 0.800000 | E160: 0.010000 | F160: 0.900000 | G160: 967 | H160: =RANK(RC[-1],R2C7:R245C7) -> 81
A161: 160 | B161: 20 | C161: 1250 | D161: 0.800000 | E161: 0.100000 | F161: 0.700000 | G161: 721 | H161: =RANK(RC[-1],R2C7:R245C7) -> 182
A162: 161 | B162: 20 | C162: 1250 | D162: 0.800000 | E162: 0.100000 | F162: 0.800000 | G162: 652 | H162: =RANK(RC[-1],R2C7:R245C7) -> 195
A163: 162 | B163: 20 | C163: 1250 | D163: 0.800000 | E163: 0.100000 | F163: 0.900000 | G163: 617 | H163: =RANK(RC[-1],R2C7:R245C7) -> 208
A164: 163 | B164: 30 | C164: 833 | D164: 0.600000 | E164: 0.001000 | F164: 0.700000 | G164: 1055 | H164: =RANK(RC[-1],R2C7:R245C7) -> 9
A165: 164 | B165: 30 | C165: 833 | D165: 0.600000 | E165: 0.001000 | F165: 0.800000 | G165: 970 | H165: =RANK(RC[-1],R2C7:R245C7) -> 79
A166: 165 | B166: 30 | C166: 833 | D166: 0.600000 | E166: 0.001000 | F166: 0.900000 | G166: 1027 | H166: =RANK(RC[-1],R2C7:R245C7) -> 23
A167: 166 | B167: 30 | C167: 833 | D167: 0.600000 | E167: 0.010000 | F167: 0.700000 | G167: 990 | H167: =RANK(RC[-1],R2C7:R245C7) -> 51
A168: 167 | B168: 30 | C168: 833 | D168: 0.600000 | E168: 0.010000 | F168: 0.800000 | G168: 1033 | H168: =RANK(RC[-1],R2C7:R245C7) -> 22
A169: 168 | B169: 30 | C169: 833 | D169: 0.600000 | E169: 0.010000 | F169: 0.900000 | G169: 1004 | H169: =RANK(RC[-1],R2C7:R245C7) -> 39
A170: 169 | B170: 30 | C170: 833 | D170: 0.600000 | E170: 0.100000 | F170: 0.700000 | G170: 866 | H170: =RANK(RC[-1],R2C7:R245C7) -> 132
A171: 170 | B171: 30 | C171: 833 | D171: 0.600000 | E171: 0.100000 | F171: 0.800000 | G171: 707 | H171: =RANK(RC[-1],R2C7:R245C7) -> 184
A172: 171 | B172: 30 | C172: 833 | D172: 0.600000 | E172: 0.100000 | F172: 0.900000 | G172: 626 | H172: =RANK(RC[-1],R2C7:R245C7) -> 207
A173: 172 | B173: 30 | C173: 833 | D173: 0.700000 | E173: 0.001000 | F173: 0.700000 | G173: 1012 | H173: =RANK(RC[-1],R2C7:R245C7) -> 31
A174: 173 | B174: 30 | C174: 833 | D174: 0.700000 | E174: 0.001000 | F174: 0.800000 | G174: 1063 | H174: =RANK(RC[-1],R2C7:R245C7) -> 6
A175: 174 | B175: 30 | C175: 833 | D175: 0.700000 | E175: 0.001000 | F175: 0.900000 | G175: 1005 | H175: =RANK(RC[-1],R2C7:R245C7) -> 36
A176: 175 | B176: 30 | C176: 833 | D176: 0.700000 | E176: 0.010000 | F176: 0.700000 | G176: 1067 | H176: =RANK(RC[-1],R2C7:R245C7) -> 5
A177: 176 | B177: 30 | C177: 833 | D177: 0.700000 | E177: 0.010000 | F177: 0.800000 | G177: 1034 | H177: =RANK(RC[-1],R2C7:R245C7) -> 21
A178: 177 | B178: 30 | C178: 833 | D178: 0.700000 | E178: 0.010000 | F178: 0.900000 | G178: 980 | H178: =RANK(RC[-1],R2C7:R245C7) -> 63
A179: 178 | B179: 30 | C179: 833 | D179: 0.700000 | E179: 0.100000 | F179: 0.700000 | G179: 821 | H179: =RANK(RC[-1],R2C7:R245C7) -> 156
A180: 179 | B180: 30 | C180: 833 | D180: 0.700000 | E180: 0.100000 | F180: 0.800000 | G180: 700 | H180: =RANK(RC[-1],R2C7:R245C7) -> 187
A181: 180 | B181: 30 | C181: 833 | D181: 0.700000 | E181: 0.100000 | F181: 0.900000 | G181: 631 | H181: =RANK(RC[-1],R2C7:R245C7) -> 205
A182: 181 | B182: 30 | C182: 833 | D182: 0.800000 | E182: 0.001000 | F182: 0.700000 | G182: 1005 | H182: =RANK(RC[-1],R2C7:R245C7) -> 36
A183: 182 | B183: 30 | C183: 833 | D183: 0.800000 | E183: 0.001000 | F183: 0.800000 | G183: 1041 | H183: =RANK(RC[-1],R2C7:R245C7) -> 14
A184: 183 | B184: 30 | C184: 833 | D184: 0.800000 | E184: 0.001000 | F184: 0.900000 | G184: 1083 | H184: =RANK(RC[-1],R2C7:R245C7) -> 2
A185: 184 | B185: 30 | C185: 833 | D185: 0.800000 | E185: 0.010000 | F185: 0.700000 | G185: 1014 | H185: =RANK(RC[-1],R2C7:R245C7) -> 29
A186: 185 | B186: 30 | C186: 833 | D186: 0.800000 | E186: 0.010000 | F186: 0.800000 | G186: 1045 | H186: =RANK(RC[-1],R2C7:R245C7) -> 12
A187: 186 | B187: 30 | C187: 833 | D187: 0.800000 | E187: 0.010000 | F187: 0.900000 | G187: 978 | H187: =RANK(RC[-1],R2C7:R245C7) -> 67
A188: 187 | B188: 30 | C188: 833 | D188: 0.800000 | E188: 0.100000 | F188: 0.700000 | G188: 832 | H188: =RANK(RC[-1],R2C7:R245C7) -> 147
A189: 188 | B189: 30 | C189: 833 | D189: 0.800000 | E189: 0.100000 | F189: 0.800000 | G189: 716 | H189: =RANK(RC[-1],R2C7:R245C7) -> 183
A190: 189 | B190: 30 | C190: 833 | D190: 0.800000 | E190: 0.100000 | F190: 0.900000 | G190: 675 | H190: =RANK(RC[-1],R2C7:R245C7) -> 190
A191: 190 | B191: 30 | C191: 1000 | D191: 0.600000 | E191: 0.001000 | F191: 0.700000 | G191: 978 | H191: =RANK(RC[-1],R2C7:R245C7) -> 67
A192: 191 | B192: 30 | C192: 1000 | D192: 0.600000 | E192: 0.001000 | F192: 0.800000 | G192: 1012 | H192: =RANK(RC[-1],R2C7:R245C7) -> 31
A193: 192 | B193: 30 | C193: 1000 | D193: 0.600000 | E193: 0.001000 | F193: 0.900000 | G193: 1013 | H193: =RANK(RC[-1],R2C7:R245C7) -> 30
A194: 193 | B194: 30 | C194: 1000 | D194: 0.600000 | E194: 0.010000 | F194: 0.700000 | G194: 1043 | H194: =RANK(RC[-1],R2C7:R245C7) -> 13
A195: 194 | B195: 30 | C195: 1000 | D195: 0.600000 | E195: 0.010000 | F195: 0.800000 | G195: 926 | H195: =RANK(RC[-1],R2C7:R245C7) -> 108
A196: 195 | B196: 30 | C196: 1000 | D196: 0.600000 | E196: 0.010000 | F196: 0.900000 | G196: 980 | H196: =RANK(RC[-1],R2C7:R245C7) -> 63
A197: 196 | B197: 30 | C197: 1000 | D197: 0.600000 | E197: 0.100000 | F197: 0.700000 | G197: 824 | H197: =RANK(RC[-1],R2C7:R245C7) -> 153
A198: 197 | B198: 30 | C198: 1000 | D198: 0.600000 | E198: 0.100000 | F198: 0.800000 | G198: 688 | H198: =RANK(RC[-1],R2C7:R245C7) -> 189
A199: 198 | B199: 30 | C199: 1000 | D199: 0.600000 | E199: 0.100000 | F199: 0.900000 | G199: 631 | H199: =RANK(RC[-1],R2C7:R245C7) -> 205
A200: 199 | B200: 30 | C200: 1000 | D200: 0.700000 | E200: 0.001000 | F200: 0.700000 | G200: 1035 | H200: =RANK(RC[-1],R2C7:R245C7) -> 19
A201: 200 | B201: 30 | C201: 1000 | D201: 0.700000 | E201: 0.001000 | F201: 0.800000 | G201: 1039 | H201: =RANK(RC[-1],R2C7:R245C7) -> 16
A202: 201 | B202: 30 | C202: 1000 | D202: 0.700000 | E202: 0.001000 | F202: 0.900000 | G202: 1056 | H202: =RANK(RC[-1],R2C7:R245C7) -> 8
A203: 202 | B203: 30 | C203: 1000 | D203: 0.700000 | E203: 0.010000 | F203: 0.700000 | G203: 1091 | H203: =RANK(RC[-1],R2C7:R245C7) -> 1
A204: 203 | B204: 30 | C204: 1000 | D204: 0.700000 | E204: 0.010000 | F204: 0.800000 | G204: 967 | H204: =RANK(RC[-1],R2C7:R245C7) -> 81
A205: 204 | B205: 30 | C205: 1000 | D205: 0.700000 | E205: 0.010000 | F205: 0.900000 | G205: 1019 | H205: =RANK(RC[-1],R2C7:R245C7) -> 27
A206: 205 | B206: 30 | C206: 1000 | D206: 0.700000 | E206: 0.100000 | F206: 0.700000 | G206: 805 | H206: =RANK(RC[-1],R2C7:R245C7) -> 164
A207: 206 | B207: 30 | C207: 1000 | D207: 0.700000 | E207: 0.100000 | F207: 0.800000 | G207: 743 | H207: =RANK(RC[-1],R2C7:R245C7) -> 178
A208: 207 | B208: 30 | C208: 1000 | D208: 0.700000 | E208: 0.100000 | F208: 0.900000 | G208: 635 | H208: =RANK(RC[-1],R2C7:R245C7) -> 202
A209: 208 | B209: 30 | C209: 1000 | D209: 0.800000 | E209: 0.001000 | F209: 0.700000 | G209: 990 | H209: =RANK(RC[-1],R2C7:R245C7) -> 51
A210: 209 | B210: 30 | C210: 1000 | D210: 0.800000 | E210: 0.001000 | F210: 0.800000 | G210: 1004 | H210: =RANK(RC[-1],R2C7:R245C7) -> 39
A211: 210 | B211: 30 | C211: 1000 | D211: 0.800000 | E211: 0.001000 | F211: 0.900000 | G211: 1036 | H211: =RANK(RC[-1],R2C7:R245C7) -> 17
A212: 211 | B212: 30 | C212: 1000 | D212: 0.800000 | E212: 0.010000 | F212: 0.700000 | G212: 1024 | H212: =RANK(RC[-1],R2C7:R245C7) -> 25
A213: 212 | B213: 30 | C213: 1000 | D213: 0.800000 | E213: 0.010000 | F213: 0.800000 | G213: 1001 | H213: =RANK(RC[-1],R2C7:R245C7) -> 43
A214: 213 | B214: 30 | C214: 1000 | D214: 0.800000 | E214: 0.010000 | F214: 0.900000 | G214: 984 | H214: =RANK(RC[-1],R2C7:R245C7) -> 56
A215: 214 | B215: 30 | C215: 1000 | D215: 0.800000 | E215: 0.100000 | F215: 0.700000 | G215: 853 | H215: =RANK(RC[-1],R2C7:R245C7) -> 141
A216: 215 | B216: 30 | C216: 1000 | D216: 0.800000 | E216: 0.100000 | F216: 0.800000 | G216: 747 | H216: =RANK(RC[-1],R2C7:R245C7) -> 177
A217: 216 | B217: 30 | C217: 1000 | D217: 0.800000 | E217: 0.100000 | F217: 0.900000 | G217: 634 | H217: =RANK(RC[-1],R2C7:R245C7) -> 204
A218: 217 | B218: 30 | C218: 1250 | D218: 0.600000 | E218: 0.001000 | F218: 0.700000 | G218: 916 | H218: =RANK(RC[-1],R2C7:R245C7) -> 111
A219: 218 | B219: 30 | C219: 1250 | D219: 0.600000 | E219: 0.001000 | F219: 0.800000 | G219: 980 | H219: =RANK(RC[-1],R2C7:R245C7) -> 63
A220: 219 | B220: 30 | C220: 1250 | D220: 0.600000 | E220: 0.001000 | F220: 0.900000 | G220: 975 | H220: =RANK(RC[-1],R2C7:R245C7) -> 74
A221: 220 | B221: 30 | C221: 1250 | D221: 0.600000 | E221: 0.010000 | F221: 0.700000 | G221: 1035 | H221: =RANK(RC[-1],R2C7:R245C7) -> 19
A222: 221 | B222: 30 | C222: 1250 | D222: 0.600000 | E222: 0.010000 | F222: 0.800000 | G222: 1009 | H222: =RANK(RC[-1],R2C7:R245C7) -> 34
A223: 222 | B223: 30 | C223: 1250 | D223: 0.600000 | E223: 0.010000 | F223: 0.900000 | G223: 1004 | H223: =RANK(RC[-1],R2C7:R245C7) -> 39
A224: 223 | B224: 30 | C224: 1250 | D224: 0.600000 | E224: 0.100000 | F224: 0.700000 | G224: 840 | H224: =RANK(RC[-1],R2C7:R245C7) -> 145
A225: 224 | B225: 30 | C225: 1250 | D225: 0.600000 | E225: 0.100000 | F225: 0.800000 | G225: 754 | H225: =RANK(RC[-1],R2C7:R245C7) -> 176
A226: 225 | B226: 30 | C226: 1250 | D226: 0.600000 | E226: 0.100000 | F226: 0.900000 | G226: 671 | H226: =RANK(RC[-1],R2C7:R245C7) -> 192
A227: 226 | B227: 30 | C227: 1250 | D227: 0.700000 | E227: 0.001000 | F227: 0.700000 | G227: 953 | H227: =RANK(RC[-1],R2C7:R245C7) -> 91
A228: 227 | B228: 30 | C228: 1250 | D228: 0.700000 | E228: 0.001000 | F228: 0.800000 | G228: 939 | H228: =RANK(RC[-1],R2C7:R245C7) -> 98
A229: 228 | B229: 30 | C229: 1250 | D229: 0.700000 | E229: 0.001000 | F229: 0.900000 | G229: 999 | H229: =RANK(RC[-1],R2C7:R245C7) -> 44
A230: 229 | B230: 30 | C230: 1250 | D230: 0.700000 | E230: 0.010000 | F230: 0.700000 | G230: 1040 | H230: =RANK(RC[-1],R2C7:R245C7) -> 15
A231: 230 | B231: 30 | C231: 1250 | D231: 0.700000 | E231: 0.010000 | F231: 0.800000 | G231: 1015 | H231: =RANK(RC[-1],R2C7:R245C7) -> 28
A232: 231 | B232: 30 | C232: 1250 | D232: 0.700000 | E232: 0.010000 | F232: 0.900000 | G232: 984 | H232: =RANK(RC[-1],R2C7:R245C7) -> 56
A233: 232 | B233: 30 | C233: 1250 | D233: 0.700000 | E233: 0.100000 | F233: 0.700000 | G233: 828 | H233: =RANK(RC[-1],R2C7:R245C7) -> 151
A234: 233 | B234: 30 | C234: 1250 | D234: 0.700000 | E234: 0.100000 | F234: 0.800000 | G234: 704 | H234: =RANK(RC[-1],R2C7:R245C7) -> 185
A235: 234 | B235: 30 | C235: 1250 | D235: 0.700000 | E235: 0.100000 | F235: 0.900000 | G235: 637 | H235: =RANK(RC[-1],R2C7:R245C7) -> 201
A236: 235 | B236: 30 | C236: 1250 | D236: 0.800000 | E236: 0.001000 | F236: 0.700000 | G236: 938 | H236: =RANK(RC[-1],R2C7:R245C7) -> 101
A237: 236 | B237: 30 | C237: 1250 | D237: 0.800000 | E237: 0.001000 | F237: 0.800000 | G237: 927 | H237: =RANK(RC[-1],R2C7:R245C7) -> 107
A238: 237 | B238: 30 | C238: 1250 | D238: 0.800000 | E238: 0.001000 | F238: 0.900000 | G238: 942 | H238: =RANK(RC[-1],R2C7:R245C7) -> 97
A239: 238 | B239: 30 | C239: 1250 | D239: 0.800000 | E239: 0.010000 | F239: 0.700000 | G239: 997 | H239: =RANK(RC[-1],R2C7:R245C7) -> 45
A240: 239 | B240: 30 | C240: 1250 | D240: 0.800000 | E240: 0.010000 | F240: 0.800000 | G240: 984 | H240: =RANK(RC[-1],R2C7:R245C7) -> 56
A241: 240 | B241: 30 | C241: 1250 | D241: 0.800000 | E241: 0.010000 | F241: 0.900000 | G241: 953 | H241: =RANK(RC[-1],R2C7:R245C7) -> 91
A242: 241 | B242: 30 | C242: 1250 | D242: 0.800000 | E242: 0.100000 | F242: 0.700000 | G242: 810 | H242: =RANK(RC[-1],R2C7:R245C7) -> 161
A243: 242 | B243: 30 | C243: 1250 | D243: 0.800000 | E243: 0.100000 | F243: 0.800000 | G243: 729 | H243: =RANK(RC[-1],R2C7:R245C7) -> 180
A244: 243 | B244: 30 | C244: 1250 | D244: 0.800000 | E244: 0.100000 | F244: 0.900000 | G244: 661 | H244: =RANK(RC[-1],R2C7:R245C7) -> 194